tipo_contrato,puesto,fuente,salario_promedio,empresa,tecnologias,fecha_publicacion,ubicacion
full_time,Semi Senior Especialista en UX/UI,Jooble,62524.0,No especificado,"Go, Rust, R, AI, REST, API, SPA, Excel",2025-05-09T04:51:14,USA
full_time,Semi Senior Científico de Datos,Adzuna,48954.0,No especificado,"Python, Go, R, Express, AWS, Azure, GCP, Kubernetes, Terraform, Ansible, AI, CI/CD, Agile, API, Linux",2025-05-06T00:50:54,EMEA
full_time,Semi Senior Especialista en Ciberseguridad,Jooble,30451.0,No especificado,"Python, Go, Scala, R, AWS, Azure, Google Cloud, Docker, Kubernetes, Terraform, Ansible, AI, DevOps, CI/CD, API",2025-05-02T18:51:25,Ukraine
full_time,Semi Senior Especialista DevSecOps,Jooble,60985.0,No especificado,"Go, R, AWS, AI, API, SPA, Excel, Git",2025-05-02T16:50:58,USA
full_time,Senior Desarrollador Full Stack,Adzuna,52060.0,No especificado,"Go, Scala, Rust, R, SQL, AWS, Azure, GCP, Machine Learning, AI, API, ETL, Tableau, Looker, Excel",2025-04-29T22:51:11,Canada
full_time,Lead Administrador de Sistemas,Jooble,38982.0,No especificado,"Go, Rust, R, AWS, GCP, AI, API, SPA, Git",2025-04-28T12:50:07,Europe
full_time,Lead Administrador de Sistemas,Adzuna,63965.0,No especificado,"Scala, Rust, R, AWS, Azure, GCP, GitLab, Terraform, Ansible, Machine Learning, AI, DevOps, Agile, Microservices, API, SPA, Excel, Git",2025-04-27T18:50:45,USA
full_time,Senior Administrador de Bases de Datos,Adzuna,38022.0,No especificado,"Python, R, Express, AI, API, SPA, Excel",2025-04-25T12:51:09,USA
full_time,Senior Desarrollador React,Adzuna,75477.0,No especificado,"Go, Rust, R, Google Cloud, GCP, AI, DevOps, Agile, REST, API, SPA, Excel, macOS",2025-04-25T02:50:59,USA
full_time,Junior Administrador de Sistemas,Adzuna,37490.0,No especificado,"JavaScript, Java, C#, Go, TypeScript, Scala, R, Express, Kubernetes, GitHub Actions, AI, CI/CD, API, SPA, Git",2025-04-24T22:51:14,Canada
full_time,Junior Administrador AWS,Adzuna,26695.0,No especificado,"Python, Java, Go, Rust, R, AWS, Azure, GCP, Docker, Kubernetes, Terraform, AI, DevOps, REST, API, SPA",2025-04-24T16:50:19,USA
full_time,Senior Desarrollador Java,Jooble,40037.0,No especificado,"Go, Rust, R, Machine Learning, AI, API, SPA, Excel, Git",2025-04-21T22:50:56,India
full_time,Lead Desarrollador Blockchain,Jooble,72334.0,No especificado,"Python, Go, R, SQL, AWS, Azure, GCP, Docker, Kubernetes, AI, REST, API, Backend, SPA, JIRA, Git",2025-04-20T08:50:16,USA
full_time,Lead Ingeniero de Machine Learning,Jooble,51233.0,No especificado,"Go, R, AI, API, SPA, Tableau, Power BI, Excel, Git",2025-04-17T10:51:31,Japan
full_time,Lead Product Owner,Adzuna,61313.0,No especificado,"Python, C++, Go, R, Azure, AI, API, Excel, Git, Windows, macOS",2025-04-04T02:51:03,USA
full_time,Semi Senior Scrum Master,Jooble,74806.0,No especificado,"Go, Scala, Rust, R, AI, API, Excel",2025-03-28T08:51:32,Japan
contract,Senior Product Owner,Jooble,39011.0,No especificado,"Go, R, SQL, AI, API, Tableau, Excel, Git",2025-06-10T20:50:58,Poland
full_time,Senior Cloud Engineer,Jooble,40143.0,No especificado,"Python, Go, Rust, R, SQL, AI, API, SPA, Tableau, Power BI, Looker",2025-06-09T12:50:56,"USA, Canada"
full_time,Semi Senior Ingeniero de Redes,Adzuna,77279.0,No especificado,"R, SQL, AI, Agile, API, Excel",2025-06-08T10:50:55,Spain
full_time,Junior Ingeniero en IA,Adzuna,43677.0,No especificado,"Go, R, SQL, DynamoDB, AWS, AI, REST, API, SPA, Tableau, Excel, Windows",2025-06-05T18:50:37,USA
full_time,Lead Technical Lead,Adzuna,60470.0,No especificado,"Go, Scala, R, SQL, AI, REST, API, SPA, Tableau, Power BI, Looker, Excel",2025-06-02T12:50:45,USA
full_time,Semi Senior Product Owner,Jooble,40904.0,No especificado,"Go, Scala, R, SQL, AI, API, ETL, Excel, Git",2025-06-02T08:50:31,USA
full_time,Lead Site Reliability Engineer,Jooble,25565.0,No especificado,"Python, Go, Scala, Rust, R, SQL, GitLab, AI, REST, API, ETL, JIRA, Git",2025-06-01T12:50:13,Europe
full_time,Junior Desarrollador Python,Jooble,69087.0,No especificado,"Python, Go, R, SQL, Express, MySQL, PostgreSQL, SQL Server, Oracle, Azure, AI, Agile, API, Tableau",2025-05-30T02:51:40,USA
full_time,Semi Senior Ingeniero de Redes,Adzuna,41646.0,No especificado,"Go, Rust, R, Express, Google Cloud, AI, API, SPA, ETL, Spark, Excel",2025-05-30T02:51:18,USA
full_time,Lead Desarrollador Backend,Jooble,31830.0,No especificado,"Go, Scala, Rust, R, SQL, AI, API, SPA, Tableau, Excel",2025-05-28T22:51:17,Germany
full_time,Junior Product Owner,Adzuna,54505.0,No especificado,"Python, Go, Scala, Rust, R, SQL, Azure, AI, API, SPA, ETL, Hadoop, Spark, Power BI, Excel",2025-05-21T02:51:41,Europe
contract,Junior Ingeniero de QA,Jooble,70035.0,No especificado,"Python, Go, Scala, R, SQL, AI, API, SPA, Tableau, Looker, Git",2025-05-16T00:50:35,Canada
full_time,Junior Especialista en UX/UI,Adzuna,70010.0,No especificado,"Python, Go, R, SQL, AI, REST, API, SPA, Looker, Excel, Git",2025-05-13T20:51:44,"USA, Canada"
full_time,Senior Product Owner,Adzuna,73169.0,No especificado,"Python, Go, R, SQL, AI, REST, API, Excel",2025-05-08T18:51:00,"Philippines, Vietnam"
full_time,Semi Senior Desarrollador Mobile,Jooble,55821.0,No especificado,"Go, Scala, Rust, R, Express, AWS, AI, REST, API, SPA",2025-05-04T16:50:56,USA
contract,Semi Senior Desarrollador React,Adzuna,76471.0,No especificado,"Go, R, SQL, AI, API, Tableau, Power BI",2025-05-01T18:50:14,UK
full_time,Senior Analista de BI,Jooble,73483.0,No especificado,"Python, Go, R, SQL, Express, AWS, Machine Learning, AI, REST, API, Excel, Git",2025-04-25T12:51:34,Mexico
full_time,Junior Technical Lead,Adzuna,59932.0,No especificado,"Python, Go, Rust, R, SQL, Express, AI, API, SPA, Excel",2025-04-24T06:50:47,Brazil
full_time,Lead Ingeniero de Machine Learning,Jooble,69006.0,No especificado,"Python, Go, R, AI, API, SPA, Spark, Tableau",2025-04-17T06:51:25,Asia
full_time,Junior Especialista DevSecOps,Jooble,67044.0,No especificado,"Python, Go, Rust, R, SQL, Express, AI, REST, API, SPA, Excel",2025-04-15T08:50:33,India
full_time,Semi Senior Especialista en Ciberseguridad,Adzuna,36078.0,No especificado,"Python, Go, R, SQL, Machine Learning, AI, API, ETL, Tableau, Power BI, Looker",2025-04-14T06:50:58,Ukraine
full_time,Junior Administrador AWS,Jooble,40331.0,No especificado,"Python, Go, Scala, R, SQL, AI, API, Tableau, Power BI, Looker, Excel",2025-04-13T08:51:17,South Africa
full_time,Lead Product Owner,Adzuna,26956.0,No especificado,"Go, TypeScript, Rust, R, React, AWS, Azure, Google Cloud, AI, REST, API, Backend, SPA, Git",2025-04-12T06:51:48,"UK, Portugal, Poland, South Africa, Romania, Spain"
full_time,Lead Desarrollador Blockchain,Adzuna,55823.0,No especificado,"Python, Go, Scala, R, SQL, AWS, Machine Learning, AI, API, SPA, Tableau, Power BI, Excel",2025-04-04T02:51:03,USA
full_time,Junior Especialista en Ciberseguridad,Jooble,62899.0,No especificado,"Go, Scala, R, SQL, Express, AWS, AI, API, SPA, ETL, Tableau, Looker",2025-04-04T00:50:04,USA
full_time,Semi Senior Analista de Datos,Jooble,42191.0,No especificado,"Go, Scala, R, SQL, Express, AI, REST, API, Tableau, Power BI, Excel",2025-03-24T04:50:40,LATAM
No especificado,Lead Ingeniero DevOps,Jooble,52818.0,Unknown Company,R,2021-07-03,Location not specified
full_time,Semi Senior Desarrollador Backend,Jooble,70571.0,No especificado,"C#, Go, R, AI, API, Git",2025-05-16T20:50:07,Ukraine
full_time,Senior Desarrollador .NET,Jooble,52299.0,No especificado,"C#, Scala, R, AWS, Azure, Docker, Kubernetes, AI, CI/CD, Agile, Microservices, API, SPA, Excel",2025-04-16T08:51:00,"Americas, LATAM"
full_time,Lead Ingeniero de Redes,Adzuna,64960.0,No especificado,"JavaScript, Java, Go, Scala, Rust, R, React, AWS, AI, Agile, API, Frontend, Backend, SPA, Git",2025-06-17T12:50:40,USA
full_time,Semi Senior Analista de BI,Adzuna,43971.0,No especificado,"Go, Scala, Rust, R, AI, API, Excel, Git",2025-06-13T04:51:27,UK
contract,Semi Senior Administrador AWS,Jooble,50531.0,No especificado,"JavaScript, Java, Go, R, AI, REST, API, Git",2025-06-08T04:51:38,Indonesia
contract,Junior Site Reliability Engineer,Jooble,75907.0,No especificado,"Go, Scala, R, AI, Agile, Scrum, REST, API, JIRA, Git",2025-06-06T22:50:32,USA
full_time,Senior Product Owner,Adzuna,28725.0,No especificado,"Python, JavaScript, Java, Go, Scala, R, AI, Agile, Scrum, API, UI/UX, Excel, Git",2025-06-05T10:50:56,Philippines
full_time,Semi Senior Arquitecto de Software,Jooble,71058.0,No especificado,"Python, Go, R, Express, AI, API, Backend, Full Stack, JIRA",2025-06-04T18:51:36,Europe
full_time,Senior Especialista en Ciberseguridad,Adzuna,62194.0,No especificado,"Go, TypeScript, Scala, Rust, R, SQL, React, PostgreSQL, AWS, AI, CI/CD, API, SPA, JIRA, Git",2025-05-30T02:52:17,Mexico
full_time,Lead Administrador de Bases de Datos,Adzuna,54693.0,No especificado,"Python, Go, R, SQL, AI, Agile, REST, API, SPA, Excel, JIRA",2025-05-27T20:51:50,Bulgaria
full_time,Semi Senior Arquitecto de Software,Adzuna,45804.0,No especificado,"JavaScript, Java, Go, TypeScript, Scala, R, Angular, AWS, Jenkins, AI, CI/CD, API, Frontend, Backend, SPA, Excel",2025-05-24T16:50:43,USA
full_time,Junior Desarrollador Python,Jooble,53878.0,No especificado,"Go, R, SQL, Agile, API, SPA",2025-05-23T14:50:50,India
full_time,Lead Especialista en UX/UI,Jooble,49407.0,No especificado,"Java, C#, Go, R, SQL, Express, Jenkins, AI, Agile, Scrum, API, SPA, Git",2025-05-22T14:51:22,Costa Rica
contract,Junior Especialista en UX/UI,Jooble,31578.0,No especificado,"R, AI, API, Excel",2025-05-17T20:51:37,"Europe, Asia, South America"
full_time,Semi Senior Ingeniero de Machine Learning,Adzuna,77402.0,No especificado,"Go, Rust, R, AI, API, SPA, Excel",2025-05-15T18:51:04,Nepal
full_time,Senior Desarrollador Frontend,Adzuna,41987.0,No especificado,"JavaScript, Java, R, AI, Agile, Scrum, API, SPA, Git",2025-05-11T10:50:36,LATAM
full_time,Lead Desarrollador Python,Adzuna,76348.0,No especificado,"R, AI, Scrum, REST, API, SPA, JIRA, Confluence",2025-05-09T14:50:44,Ukraine
full_time,Junior Scrum Master,Jooble,60152.0,No especificado,"Go, R, AI, REST, API, SPA, Excel, Git",2025-05-09T06:50:50,European timezones
full_time,Semi Senior Desarrollador React,Jooble,54941.0,No especificado,"Java, Go, R, Angular, AWS, Azure, Docker, AI, CI/CD, Agile, Scrum, REST, Microservices, API, SPA, Spark, Excel, Git",2025-05-08T20:50:12,Costa Rica
full_time,Lead Ingeniero en IA,Adzuna,78791.0,No especificado,"C#, Go, Scala, R, SQL, MySQL, PostgreSQL, MongoDB, Docker, GitLab, AI, CI/CD, Agile, REST, Microservices, API, SPA, Git",2025-05-07T02:51:52,Worldwide
full_time,Senior Especialista en UX/UI,Jooble,40338.0,No especificado,"Python, Ruby, Scala, Rust, R, SQL, Express, AWS, Azure, Docker, Kubernetes, Jenkins, Ansible, AI, DevOps, CI/CD, Microservices, API, SPA, Git",2025-05-06T00:50:53,USA
full_time,Junior Desarrollador Java,Adzuna,52488.0,No especificado,"R, AI, Agile, Scrum, REST, API, Excel, JIRA",2025-05-04T02:51:01,Europe
contract,Semi Senior Administrador AWS,Adzuna,48850.0,No especificado,"JavaScript, Java, Go, R, Flutter, AI, API, SPA, JIRA, Git",2025-05-03T10:50:36,Northern America
full_time,Senior Desarrollador React,Adzuna,30195.0,No especificado,"Scala, R, SQL, AI, CI/CD, Agile, API, JIRA",2025-05-01T22:51:10,"Europe, UK"
full_time,Semi Senior Desarrollador Mobile,Jooble,44153.0,No especificado,"C#, Scala, R, SQL, AI, REST, API, SPA, JIRA, Git",2025-04-30T22:50:51,USA
full_time,Semi Senior Desarrollador Mobile,Jooble,29951.0,No especificado,"Java, Go, Kotlin, R, SQL, PostgreSQL, Kubernetes, GitHub Actions, AI, CI/CD, REST, API, JIRA, Git",2025-04-27T20:50:07,Turkey
full_time,Lead Especialista en UX/UI,Adzuna,58185.0,No especificado,"Go, Rust, R, AI, CI/CD, API, SPA, Excel",2025-04-20T16:51:35,"Portugal, Georgia, Spain, Serbia, Armenia"
full_time,Semi Senior Cloud Engineer,Jooble,49902.0,No especificado,"Go, TypeScript, R, AI, Agile, API, SPA, Excel, JIRA, Git",2025-04-18T10:51:00,Mexico
full_time,Junior Especialista en UX/UI,Jooble,47841.0,No especificado,"Python, Go, Swift, Scala, R, Express, Docker, Jenkins, AI, CI/CD, API, SPA, Excel, Git",2025-04-16T08:51:45,USA
contract,Lead Especialista en Ciberseguridad,Jooble,77954.0,No especificado,"Go, Scala, R, AI, Agile, Scrum, API, Git",2025-04-13T08:51:33,Poland
full_time,Junior Desarrollador Mobile,Adzuna,26338.0,No especificado,"TypeScript, Scala, R, React, AI, CI/CD, API, TDD, BDD, Excel",2025-04-11T08:51:26,USA
contract,Junior Analista de BI,Adzuna,62535.0,No especificado,"JavaScript, Java, Go, TypeScript, Scala, R, AI, Agile, REST, API, SPA, Excel",2025-03-31T22:50:34,Vietnam
full_time,Semi Senior Desarrollador .NET,Adzuna,40544.0,No especificado,"Rust, R, Express, AWS, AI, API, SPA, Excel",2025-06-12T18:50:17,India
full_time,Junior Scrum Master,Adzuna,65957.0,No especificado,"Go, Rust, R, Express, AI, REST, API, Excel",2025-06-10T18:50:46,USA
full_time,Senior Ingeniero de QA,Adzuna,65495.0,No especificado,"Go, R, AWS, AI, REST, API, SPA, Excel, Git",2025-06-06T12:50:47,USA
full_time,Lead Ingeniero en IA,Jooble,33917.0,No especificado,"Go, Scala, Rust, R, SQL, Express, AI, REST, API, SPA, Excel",2025-06-03T10:50:40,Mexico
full_time,Semi Senior Arquitecto de Software,Jooble,50381.0,No especificado,"R, AWS, AI, REST, API, SPA, Git",2025-05-31T00:51:37,USA
full_time,Senior Especialista en UX/UI,Adzuna,32968.0,No especificado,"Go, R, Redis, AI, API, SPA, Git",2025-05-29T00:51:07,USA
full_time,Lead Cloud Engineer,Adzuna,70045.0,No especificado,"JavaScript, Java, TypeScript, Scala, R, Express, Jenkins, GitHub Actions, AI, CI/CD, Agile, API, Backend, Excel, Git",2025-05-28T22:51:28,USA
full_time,Semi Senior Desarrollador Blockchain,Jooble,35017.0,No especificado,"Rust, R, AWS, AI, REST, API, Git",2025-05-23T06:51:04,USA
full_time,Lead Desarrollador Backend,Adzuna,25928.0,No especificado,"Go, R, AWS, AI, Deep Learning, API, Excel, Git",2025-05-22T04:50:02,Germany
full_time,Junior Desarrollador Full Stack,Jooble,74116.0,No especificado,"Go, Rust, R, SQL, AI, API, SPA, Tableau, Looker, Excel",2025-05-14T10:50:50,USA
full_time,Junior Científico de Datos,Jooble,76958.0,No especificado,"Scala, Rust, R, AWS, AI, DevOps, CI/CD, REST, API, Excel",2025-05-14T06:50:17,Brazil
full_time,Lead Cloud Engineer,Adzuna,32135.0,No especificado,"Python, Go, TypeScript, R, React, Vue, MongoDB, AWS, Azure, GCP, Docker, Kubernetes, GitHub Actions, Terraform, AI, DevOps, CI/CD, REST, API, Frontend, Backend, SPA, Excel, Git, Linux",2025-05-14T02:52:18,"USA, Canada"
full_time,Senior Analista de Datos,Adzuna,76440.0,No especificado,"Python, JavaScript, Java, Go, Scala, Rust, R, SQL, React, Express, Google Cloud, GCP, Kubernetes, Terraform, AI, DevOps, REST, API, Frontend, Backend, SPA, Excel, Git",2025-05-13T16:50:14,India
full_time,Semi Senior Ingeniero de Software,Jooble,74928.0,No especificado,"Go, Scala, R, SQL, MySQL, PostgreSQL, MongoDB, Cassandra, AWS, Terraform, Ansible, AI, DevOps, CI/CD, API, SPA, Spark, Excel, Git, Linux",2025-05-09T20:50:59,USA
full_time,Senior Ingeniero de Software,Jooble,46232.0,No especificado,"Python, Java, Go, Scala, R, Spring, AI, REST, Microservices, API, Backend, SPA, Git",2025-05-09T02:50:14,USA
full_time,Senior Ingeniero DevOps,Adzuna,61510.0,No especificado,"Scala, Rust, R, AWS, GCP, Docker, Kubernetes, Terraform, Ansible, AI, DevOps, API, Git, Linux",2025-05-08T04:50:22,Worldwide
full_time,Lead Analista de BI,Adzuna,25880.0,No especificado,"Go, TypeScript, Rust, R, GCP, Heroku, AI, REST, API, ETL, Excel, Git",2025-05-04T02:50:55,"Europe, USA, Canada"
full_time,Lead Analista de Datos,Adzuna,67206.0,No especificado,"Python, Java, Go, Scala, R, SQL, Express, MySQL, AWS, Jenkins, GitLab, AI, DevOps, API, SPA, Git",2025-05-03T20:50:42,Poland
full_time,Semi Senior Analista de Datos,Jooble,42451.0,No especificado,"Go, Scala, R, React, AWS, Azure, Google Cloud, Docker, Kubernetes, Terraform, AI, DevOps, REST, API, SPA, Excel, Git",2025-04-28T06:51:07,USA
full_time,Senior Site Reliability Engineer,Adzuna,76363.0,No especificado,"Go, TypeScript, Scala, Rust, R, SQL, PostgreSQL, AWS, GCP, Kubernetes, Terraform, AI, DevOps, API, Git",2025-04-27T18:51:04,Europe
full_time,Senior Desarrollador Python,Adzuna,35775.0,No especificado,"Go, Scala, Rust, R, AWS, Google Cloud, Docker, Kubernetes, GitHub Actions, Terraform, Ansible, Machine Learning, AI, REST, API, Git, Linux",2025-04-22T10:50:37,USA
full_time,Senior Ingeniero de Software,Adzuna,49143.0,No especificado,"Python, Swift, Scala, R, SQL, Express, MySQL, PostgreSQL, AWS, Azure, GCP, Docker, Kubernetes, Terraform, Ansible, AI, CI/CD, API",2025-04-18T06:51:21,USA
full_time,Junior Ingeniero de Machine Learning,Adzuna,57952.0,No especificado,"Go, Scala, R, SQL, Express, MySQL, AWS, Kubernetes, Jenkins, GitLab, AI, DevOps, API, SPA, Git",2025-04-05T18:50:51,Poland
full_time,Senior Ingeniero en IA,Jooble,31102.0,No especificado,"Python, Go, Scala, R, AWS, Azure, GCP, Docker, Kubernetes, Terraform, Ansible, AI, DevOps, CI/CD, API, SPA, Linux",2025-03-28T02:51:52,"USA, UK, Canada, Germany, France, Spain"
full_time,Senior Desarrollador .NET,Adzuna,68165.0,No especificado,"Python, Java, C#, Go, Ruby, Rust, R, Express, Neo4j, AWS, Azure, GCP, Docker, Kubernetes, Terraform, Ansible, AI, DevOps, CI/CD, REST, API, SPA, Excel",2025-03-28T02:51:50,USA
full_time,Senior Desarrollador React,Adzuna,69696.0,No especificado,"Python, Java, Go, Scala, Rust, R, AWS, Azure, Google Cloud, GCP, Docker, Kubernetes, AI, DevOps, CI/CD, Microservices, API, Frontend, Backend, SPA, Spark, Excel, Git",2025-03-25T16:50:21,Netherlands
full_time,Semi Senior Especialista DevSecOps,Adzuna,68988.0,No especificado,"Python, Java, Go, Rust, R, SQL, AWS, AI, Agile, API, SPA, ETL, Spark",2025-05-31T04:50:49,USA
,Python developer,Jooble,53599.0,,,,
,Junior Desarrollador Blockchain,Adzuna,65802.0,IGT,,2025-06-11T07:33:31.4670000,Kingdom of Spain
,Lead Especialista en UX/UI,Jooble,41358.0,IGT,,2025-06-02T20:52:59.4930000,Kingdom of Spain
,Semi Senior Científico de Datos,Jooble,41435.0,IGT,,2025-05-27T08:47:37.6170000,Kingdom of Spain
,Senior Desarrollador Java,Adzuna,47001.0,IGT,,2025-05-25T00:00:00.0000000,Kingdom of Spain
,Semi Senior Scrum Master,Adzuna,60778.0,Heap,,2025-05-22T23:28:40.6070632+00:00,Kingdom of Spain
,Junior Ingeniero DevOps,Jooble,67898.0,SpotOn Connections,,2025-06-16T16:00:44.7330000,Kingdom of Spain
,Semi Senior Ingeniero de Software,Jooble,43655.0,Heap,,2025-05-31T04:44:17.1317421+00:00,Kingdom of Spain
,Lead Ingeniero de QA,Jooble,27178.0,Heap,,2025-06-09T07:54:29.1770000,Kingdom of Spain
,Semi Senior Scrum Master,Adzuna,26964.0,Jet Aviation,,2025-06-06T19:31:52.6830000,Kingdom of Spain
,Semi Senior Desarrollador Blockchain,Adzuna,28781.0,First Health Care of Puerto Rico,,2025-05-30T08:09:38.8645890+00:00,Kingdom of Spain
,Semi Senior Especialista en UX/UI,Jooble,49487.0,,,2025-06-18T13:40:28.9378095+00:00,Kingdom of Spain
,Senior Scrum Master,Adzuna,43657.0,Hasbro,,2025-05-27T00:00:00.0000000,Kingdom of Spain
,Junior Desarrollador Blockchain,Adzuna,34886.0,IGT,,2025-06-10T07:33:38.1330000,Kingdom of Spain
,Junior Administrador de Bases de Datos,Adzuna,69107.0,,,2025-05-16T14:34:00.3240843+00:00,Kingdom of Spain
,Semi Senior Scrum Master,Adzuna,48059.0,,,2025-06-13T05:13:20.1930000,Kingdom of Spain
,Junior Administrador de Sistemas,Jooble,70243.0,Jet Aviation,,2025-06-09T00:00:00.0000000,Kingdom of Spain
,Junior Desarrollador Backend,Adzuna,52090.0,IGT,,2025-05-23T00:00:00.0000000,Kingdom of Spain
,Junior Analista de BI,Adzuna,60775.0,Jet Aviation,,2025-05-29T00:00:00.0000000,Kingdom of Spain
,Junior Ingeniero DevOps,Adzuna,31881.0,IGT,,2025-06-13T00:00:00.0000000,Kingdom of Spain
,Lead Desarrollador Full Stack,Adzuna,37324.0,Teva Pharmaceutical Industries Ltd.,,2025-05-29T07:24:41.9904889+00:00,Kingdom of Spain
,Junior Científico de Datos,Adzuna,45291.0,First Health Care of Puerto Rico,,2025-06-17T12:02:36.1670000,Kingdom of Spain
,Senior Ingeniero de Software,Jooble,76191.0,Avincis,,2025-06-07T00:00:00.0000000,Kingdom of Spain
,Senior Cloud Engineer,Adzuna,47268.0,Heap,,2025-05-24T04:44:24.3173272+00:00,Kingdom of Spain
part_time,Senior Ingeniero en IA,Jooble,65570.0,No especificado,"Python, JavaScript, Java, Go, R, SQL, React, Vue, Django, Flask, PostgreSQL, MongoDB, AWS, Azure, Docker, AI, REST, API, Backend, SPA, Excel, Git",2025-05-31T04:50:50,Germany
full_time,Senior Scrum Master,Jooble,55198.0,No especificado,"Python, Go, Scala, R, AWS, Docker, Kubernetes, GitHub Actions, Terraform, AI, CI/CD, API, Backend, Git, Linux",2025-04-18T12:50:58,USA
full_time,Lead Especialista en UX/UI,Jooble,59420.0,No especificado,"Python, Scala, R, AWS, Azure, GCP, Docker, Kubernetes, Machine Learning, AI, DevOps, CI/CD, API, SPA",2025-04-14T06:51:03,Worldwide
full_time,Senior Product Owner,Adzuna,50716.0,No especificado,"Python, Go, R, SQL, AI, API, SPA, Tableau, Looker",2025-06-16T12:51:36,Europe
full_time,Junior Ingeniero de Machine Learning,Adzuna,29666.0,No especificado,"Python, R, SQL, AI, API, SPA, Tableau, Power BI, Excel, Git",2025-06-16T12:51:34,USA
full_time,Semi Senior Especialista DevSecOps,Jooble,32251.0,No especificado,"Scala, R, AI, API, SPA, Spark, Excel",2025-06-15T10:51:50,USA
full_time,Junior Administrador de Bases de Datos,Adzuna,69394.0,No especificado,"Go, TypeScript, R, SQL, React, Express, PostgreSQL, AWS, AI, GraphQL, API, Frontend, Backend",2025-06-15T10:50:51,USA
full_time,Junior Cloud Engineer,Adzuna,37777.0,No especificado,"Python, Java, C++, Go, R, SQL, MongoDB, Cassandra, Machine Learning, AI, Deep Learning, REST, API, SPA, Hadoop, Spark, Excel",2025-06-14T14:50:47,"Northern America, Americas, Europe"
full_time,Lead Arquitecto de Software,Adzuna,61834.0,No especificado,"Go, Rust, R, AI, API, SPA",2025-06-11T18:50:34,UK
full_time,Lead Administrador AWS,Jooble,26523.0,No especificado,"Go, Rust, R, Machine Learning, AI, API, SPA, Git",2025-06-10T22:51:26,USA
full_time,Semi Senior Ingeniero de Machine Learning,Adzuna,42307.0,No especificado,"Python, Go, TypeScript, Rust, R, React, Django, Express, FastAPI, AWS, Azure, GCP, Docker, Kubernetes, AI, DevOps, API, Backend, Excel",2025-06-10T18:50:39,USA
full_time,Junior Desarrollador Frontend,Adzuna,57419.0,No especificado,"Python, Java, Scala, R, AWS, Azure, GCP, Machine Learning, AI, DevOps, API",2025-06-10T00:50:49,USA
full_time,Semi Senior Analista de BI,Jooble,33501.0,No especificado,"Python, Go, R, Machine Learning, AI, API, SPA",2025-06-09T10:29:12,European timezones
full_time,Semi Senior Especialista en UX/UI,Jooble,41099.0,No especificado,"Python, JavaScript, Java, C#, Go, Scala, R, SQL, Neo4j, AWS, Azure, Jenkins, Terraform, AI, DevOps, CI/CD, Agile, API, SPA, ETL, Excel, Git",2025-06-09T08:50:26,USA
full_time,Lead Site Reliability Engineer,Jooble,27194.0,No especificado,"Go, Scala, R, AI, Agile, API, SPA, Excel",2025-06-08T10:50:44,USA
full_time,Lead Ingeniero DevOps,Adzuna,72851.0,No especificado,"Python, Java, Go, Scala, R, SQL, React, AWS, Azure, GCP, Machine Learning, AI, API, SPA, ETL, Spark, Excel, Git",2025-06-07T20:50:40,USA
full_time,Junior Desarrollador Java,Jooble,36146.0,No especificado,"Python, Java, Go, Scala, R, AWS, Docker, Terraform, Machine Learning, AI, CI/CD, REST, API, SPA, Excel, Git",2025-06-06T20:50:29,USA
full_time,Lead Ingeniero de Software,Adzuna,64000.0,No especificado,"Go, Rust, R, AI, API, SPA, Excel, Git",2025-06-04T00:50:59,USA
full_time,Junior Administrador de Bases de Datos,Jooble,68093.0,No especificado,"Go, Rust, R, AI, API, SPA, Excel",2025-06-03T00:50:52,USA
full_time,Lead Desarrollador Full Stack,Jooble,71980.0,No especificado,"Go, Scala, Rust, R, Express, AI, API, SPA, Git",2025-06-01T22:50:48,Brazil
full_time,Lead Ingeniero de Redes,Adzuna,70809.0,No especificado,"Python, Go, R, SQL, Vue, Express, FastAPI, PostgreSQL, Redis, AWS, Docker, Kubernetes, AI, CI/CD, REST, Microservices, API, Backend, SPA, ETL, Spark, Git",2025-06-01T14:50:48,USA
full_time,Lead Desarrollador Backend,Jooble,55962.0,No especificado,"Python, Go, Scala, R, AWS, GCP, Docker, Kubernetes, Jenkins, GitLab, Terraform, AI, CI/CD, REST, API, SPA, Excel, Git",2025-06-01T06:51:33,USA
full_time,Senior Desarrollador React,Adzuna,71769.0,No especificado,"Python, Go, R, SQL, Express, AWS, Machine Learning, AI, Agile, API, SPA, Spark, Excel",2025-05-31T22:50:21,Poland
full_time,Junior Cloud Engineer,Adzuna,74410.0,No especificado,"Python, Go, Scala, R, SQL, Machine Learning, AI, API, SPA, ETL, Excel",2025-05-31T00:50:39,USA
full_time,Junior Administrador de Bases de Datos,Adzuna,53156.0,No especificado,"Go, Ruby, R, Rails, AWS, AI, DevOps, Agile, API, Frontend, Backend, SPA, Git",2025-05-30T20:30:49,Worldwide
contract,Junior Administrador AWS,Jooble,55431.0,No especificado,"Python, Go, Scala, R, SQL, AWS, Azure, Google Cloud, Docker, Terraform, AI, DevOps, API, SPA, ETL, Spark, Excel",2025-05-28T22:50:18,Colombia
full_time,Junior Ingeniero de Redes,Adzuna,29469.0,No especificado,"Python, Go, Scala, R, SQL, Google Cloud, GCP, Machine Learning, AI, REST, API, Excel",2025-05-27T14:51:01,USA
full_time,Senior Administrador de Bases de Datos,Adzuna,44145.0,No especificado,"Python, Go, TypeScript, Scala, R, React, Express, Kubernetes, GitHub Actions, Machine Learning, AI, CI/CD, Agile, REST, API, UI/UX, Full Stack, SPA, Excel, Git",2025-05-27T10:50:50,USA
full_time,Junior Cloud Engineer,Adzuna,45653.0,No especificado,"Python, Go, Swift, Scala, Rust, R, SQL, AWS, Azure, GCP, Kubernetes, GitHub Actions, Terraform, Machine Learning, AI, DevOps, CI/CD, REST, API, SPA, ETL, Spark, Excel, Git",2025-05-26T14:50:12,USA
full_time,Semi Senior Desarrollador React,Adzuna,26014.0,No especificado,"Go, R, AI, REST, API, SPA",2025-05-26T04:50:50,USA
full_time,Junior Cloud Engineer,Jooble,57542.0,No especificado,"Go, R, AI, API, SPA",2025-05-24T22:51:02,USA
full_time,Senior Científico de Datos,Adzuna,78955.0,No especificado,"Python, Go, Scala, Rust, R, SQL, AI, REST, API, SPA, Tableau, Looker, Git",2025-05-23T06:50:46,USA
