tipo_contrato,puesto,fuente,salario_promedio,empresa,tecnologias,fecha_publicacion,ubicacion
full_time,Junior Site Reliability Engineer,Jooble,54437.0,No especificado,"Python, Go, Rust, R, SQL, Flask, Express, PostgreSQL, Redis, Elasticsearch, Machine Learning, AI, Agile, REST, API, SPA",2025-04-18T04:50:16,USA
full_time,Junior Desarrollador Python,Jooble,77562.0,No especificado,"Go, R, Kubernetes, Machine Learning, AI, REST, API, SPA, Spark",2025-04-14T10:51:10,USA
full_time,Junior Technical Lead,Adzuna,46320.0,No especificado,"Go, R, Neo4j, AI, Agile, Scrum, REST, API, SPA, Excel, JIRA, Confluence",2025-04-12T18:50:43,India
full_time,Semi Senior Product Owner,Adzuna,63263.0,No especificado,"Python, JavaScript, Java, PHP, Go, Scala, R, SQL, AI, API, ETL, Tableau, Looker, Git",2025-04-08T02:51:08,Worldwide
full_time,Semi Senior Especialista en UX/UI,Jooble,34369.0,No especificado,"Go, R, AI, API, SPA, Excel",2025-04-03T18:51:29,USA
full_time,Senior Ingeniero de Redes,Adzuna,67915.0,No especificado,"Python, Go, Scala, R, Express, AWS, Docker, Kubernetes, Jenkins, GitLab, Terraform, Machine Learning, AI, DevOps, CI/CD, Microservices, API, SPA, Excel, Git",2025-04-03T00:50:47,USA
full_time,Junior Technical Lead,Adzuna,30293.0,No especificado,"Python, Go, Rust, R, SQL, Machine Learning, AI, API, SPA, ETL, Excel",2025-04-02T16:50:42,USA
full_time,Junior Analista de Datos,Jooble,45101.0,No especificado,"Python, Go, Scala, R, Machine Learning, AI, Microservices, API, Backend, SPA",2025-04-01T14:50:49,USA
full_time,Lead Arquitecto de Software,Adzuna,70460.0,No especificado,"Python, Go, Scala, R, React, Express, AWS, Terraform, Machine Learning, AI, API, SPA, Excel",2025-03-24T04:50:18,USA
full_time,Lead Desarrollador Blockchain,Jooble,35610.0,No especificado,"Python, Go, Swift, R, SQL, Vue, Machine Learning, AI, REST, API, SPA, JIRA",2025-03-23T02:51:00,USA
full_time,Semi Senior Ingeniero de QA,Jooble,30499.0,No especificado,"JavaScript, Java, Go, R, React, Machine Learning, AI, REST, API, Frontend, Backend, SPA, Git",2025-06-17T12:50:41,"Europe, South America"
full_time,Junior Desarrollador Backend,Adzuna,73489.0,No especificado,"JavaScript, Java, C++, Go, Kotlin, Rust, R, Express, Redis, AWS, AI, API, SPA, Excel",2025-06-17T12:50:37,France
full_time,Senior Científico de Datos,Jooble,38225.0,No especificado,"JavaScript, Java, Go, Scala, R, SQL, React, Angular, Spring, MySQL, PostgreSQL, MongoDB, Redis, Azure, AI, Agile, REST, Microservices, API, Frontend, Backend, Excel, JIRA, Confluence, Git",2025-06-16T10:50:44,India
full_time,Junior Ingeniero en IA,Jooble,48757.0,No especificado,"Rust, R, AWS, Kubernetes, Terraform, Machine Learning, AI, DevOps, API, SPA, Tableau",2025-06-15T10:52:07,USA
full_time,Lead Desarrollador .NET,Jooble,31725.0,No especificado,"JavaScript, Java, Go, R, Express, MongoDB, AWS, Kubernetes, AI, REST, API, Frontend, Backend, SPA, Git",2025-06-14T14:50:46,USA
full_time,Lead Desarrollador Python,Jooble,52946.0,No especificado,"Go, R, AWS, Machine Learning, AI, API",2025-06-13T12:51:28,Egypt
full_time,Lead Desarrollador Frontend,Adzuna,68992.0,No especificado,"Python, JavaScript, Java, C#, Go, Scala, R, SQL, Express, AWS, Azure, GCP, Docker, Kubernetes, Terraform, Ansible, AI, DevOps, CI/CD, Microservices, API, SPA, Excel, Git",2025-06-13T12:50:54,Costa Rica
full_time,Junior Technical Lead,Jooble,70195.0,No especificado,"Python, JavaScript, Java, Go, Ruby, TypeScript, Scala, R, Express, Rails, Redis, AWS, AI, CI/CD, API, SPA, TDD, Excel",2025-06-13T12:50:52,Canada
full_time,Senior Cloud Engineer,Adzuna,77694.0,No especificado,"Swift, Scala, Rust, R, SQL, Elasticsearch, AWS, AI, REST, Microservices, API, Backend, Excel, Git",2025-06-13T08:51:08,Brazil
full_time,Lead Site Reliability Engineer,Jooble,42332.0,No especificado,"Go, Scala, R, AWS, GCP, Docker, Kubernetes, Machine Learning, AI, API, Backend, SPA",2025-06-13T04:51:02,USA
full_time,Senior Ingeniero de Machine Learning,Jooble,60161.0,No especificado,"JavaScript, Java, Go, TypeScript, Scala, R, React, AWS, GitHub Actions, Terraform, AI, DevOps, CI/CD, Agile, Microservices, API, Backend, Excel, Git",2025-06-12T10:50:50,Philippines
full_time,Lead Ingeniero de Redes,Jooble,46279.0,No especificado,"Python, Java, PHP, Go, Rust, R, AI, Agile, Scrum, API, Excel, Git, Linux",2025-06-11T10:50:44,Greece
full_time,Lead Ingeniero de Machine Learning,Jooble,38473.0,No especificado,"Python, Java, C#, C++, Go, R, MongoDB, Redis, AWS, AI, DevOps, Agile, REST, Microservices, API, Excel",2025-06-11T10:50:40,Germany
full_time,Senior Desarrollador .NET,Jooble,73983.0,No especificado,"Go, Ruby, Scala, Rust, R, React, Rails, AWS, Azure, Kubernetes, Terraform, Ansible, AI, REST, API, Frontend, Backend, SPA",2025-06-10T08:51:17,Europe
internship,Semi Senior Ingeniero de QA,Adzuna,47774.0,No especificado,"Python, Java, Go, Scala, R, Express, AWS, AI, Agile, API, Excel",2025-06-10T08:50:55,USA
full_time,Lead Ingeniero en IA,Jooble,48564.0,No especificado,"Go, Scala, Rust, R, AI, DevOps, REST, API, JSON, Backend, SPA, Excel",2025-06-10T08:50:54,USA
full_time,Lead Desarrollador Frontend,Adzuna,32688.0,No especificado,"Go, Ruby, Scala, R, React, Rails, AWS, AI, REST, API, Frontend, Backend, SPA",2025-06-10T08:50:53,USA
full_time,Senior Cloud Engineer,Jooble,59879.0,No especificado,"Go, R, Kubernetes, AI, API, SPA, Linux, Windows",2025-06-10T08:50:53,Turkey
full_time,Senior Desarrollador Frontend,Jooble,55708.0,No especificado,"JavaScript, Java, C#, Go, Scala, Rust, R, Kubernetes, AI, DevOps, API, Git",2025-06-09T16:51:19,Canada
full_time,Junior Ingeniero de Software,Adzuna,65784.0,No especificado,"Go, Rust, R, Express, AI, REST, API, SPA, Git",2025-06-09T14:50:44,Portugal
full_time,Semi Senior Ingeniero de Software,Adzuna,62210.0,No especificado,"Python, Scala, Rust, R, Docker, Kubernetes, Machine Learning, AI, DevOps, CI/CD, API, Backend, Excel, Git",2025-06-09T08:50:26,USA
full_time,Junior Site Reliability Engineer,Jooble,72710.0,No especificado,"Python, Java, Go, R, SQL, MySQL, PostgreSQL, MongoDB, Docker, Jenkins, GitLab, AI, DevOps, CI/CD, REST, API, SPA, Excel, Git",2025-06-09T06:51:16,Singapore
full_time,Senior Desarrollador Blockchain,Jooble,66966.0,No especificado,"Python, Go, Scala, Rust, R, Express, AWS, Docker, AI, API, SPA, Linux, Windows",2025-06-08T04:51:33,"USA, UK, Canada, Germany, France, India, Brazil, Australia, Estonia, Japan, Portugal, Sweden, Greece, Belgium, Hungary, Poland, South Africa, Ireland, Switzerland, Netherlands, Argentina, Finland, Malta, Singapore, Romania, Bulgaria, Czech Republic, Croatia, Israel, Spain, Mexico, Austria, Iceland, Slovakia, Cyprus, Kyrgyzstan, Latvia, Uruguay"
full_time,Semi Senior Ingeniero en IA,Adzuna,56201.0,No especificado,"Java, C#, PHP, Go, Scala, R, SQL, MySQL, Redis, MariaDB, Kubernetes, Terraform, AI, DevOps, API, Backend, Excel",2025-06-07T04:50:29,Canada
full_time,Lead Scrum Master,Adzuna,25606.0,No especificado,"Go, Rust, R, Spring, AWS, Docker, AI, CI/CD, API, Excel, Git",2025-06-07T00:50:52,Northern America
full_time,Senior Desarrollador Blockchain,Adzuna,78477.0,No especificado,"Python, Go, Scala, R, AWS, Azure, Jenkins, GitHub Actions, Terraform, Ansible, AI, DevOps, CI/CD, Agile, API, SPA, Excel, Git",2025-06-06T22:50:57,USA
full_time,Lead Desarrollador Frontend,Adzuna,54632.0,No especificado,"Python, Go, Scala, R, SQL, Express, AI, DevOps, Agile, REST, API, Backend, Excel",2025-06-06T22:50:31,USA
full_time,Lead Arquitecto de Software,Adzuna,47461.0,No especificado,"Python, Go, TypeScript, Scala, R, SQL, React, Django, MySQL, AWS, AI, REST, API, Frontend, Backend, Full Stack, SPA, Excel",2025-06-06T20:50:28,USA
full_time,Senior Ingeniero de Software,Adzuna,43542.0,No especificado,"Python, Go, Rust, R, AWS, Azure, Docker, Kubernetes, Terraform, Ansible, Machine Learning, AI, DevOps, CI/CD, REST, API, SPA, Excel, Git, Linux, Windows",2025-06-05T20:50:54,USA
full_time,Lead Desarrollador Java,Adzuna,63434.0,No especificado,"Java, Go, Scala, R, SQL, Express, AWS, AI, REST, API, SPA, Linux",2025-06-05T20:50:34,USA
full_time,Senior Especialista en Ciberseguridad,Adzuna,50854.0,No especificado,"Python, Go, R, SQL, Machine Learning, AI, REST, API, Excel",2025-06-05T20:50:34,India
full_time,Semi Senior Technical Lead,Adzuna,60841.0,No especificado,"Go, Scala, R, Express, AWS, AI, Agile, API, SPA, Excel",2025-06-05T14:50:10,USA
full_time,Senior Scrum Master,Jooble,60495.0,No especificado,"Python, JavaScript, Java, C#, C++, Go, Ruby, Scala, Rust, R, SQL, React, Angular, Django, Rails, MySQL, SQL Server, AWS, Docker, Jenkins, GitHub Actions, AI, CI/CD, API, Excel, Git",2025-06-05T12:50:43,"USA, Canada, India"
full_time,Lead Desarrollador Python,Adzuna,76389.0,No especificado,"Go, Scala, R, SQL, AWS, Azure, GCP, AI, REST, API, Backend, SPA, Spark, Linux",2025-06-05T02:50:22,USA
full_time,Semi Senior Ingeniero DevOps,Adzuna,46650.0,No especificado,"Go, Ruby, Scala, Rust, R, SQL, React, Rails, AI, API, Backend, Excel",2025-06-04T18:51:05,India
full_time,Semi Senior Cloud Engineer,Jooble,69504.0,No especificado,"Python, Go, R, Express, Machine Learning, AI, API, SPA, Excel",2025-06-02T06:50:59,USA
full_time,Senior Analista de Datos,Adzuna,34459.0,No especificado,"Python, Java, Go, Scala, R, SQL, MySQL, Redis, AWS, Azure, GCP, Docker, Kubernetes, Machine Learning, AI, CI/CD, REST, Microservices, API, SPA, Excel",2025-06-01T22:50:47,India
full_time,Junior Cloud Engineer,Jooble,36635.0,No especificado,"Python, JavaScript, Java, Ruby, R, AI, Agile, REST, API, SPA",2025-06-01T04:51:15,Canada
internship,Semi Senior Cloud Engineer,Jooble,31524.0,No especificado,"Python, Java, C++, Go, R, Spring, Machine Learning, AI, REST, API, SPA, Spark, Excel",2025-06-01T04:51:13,Canada
contract,Junior Desarrollador Frontend,Jooble,46193.0,No especificado,"Go, Rust, R, Express, AI, REST, API, Excel",2025-05-31T12:51:06,USA
full_time,Senior Ingeniero de Redes,Jooble,53448.0,No especificado,"Python, Go, Scala, R, Next.js, FastAPI, AWS, Docker, Jenkins, GitHub Actions, Terraform, Machine Learning, AI, CI/CD, REST, API, Frontend, Backend, Excel, Git",2025-05-30T20:50:21,Germany
full_time,Senior Especialista DevSecOps,Jooble,43874.0,No especificado,"Go, R, Google Cloud, Docker, Kubernetes, GitLab, Machine Learning, AI, Deep Learning, CI/CD, API, SPA, ETL, Git, Linux",2025-05-30T02:51:51,Switzerland
full_time,Junior Desarrollador Mobile,Jooble,61915.0,No especificado,"Go, Scala, Rust, R, Express, AWS, AI, DevOps, API, SPA, Excel, JIRA",2025-05-30T02:51:24,USA
full_time,Junior Desarrollador React,Adzuna,47158.0,No especificado,"Go, Scala, R, Express, Flutter, AI, Agile, REST, Microservices, API, Backend, SPA, Git",2025-05-30T02:50:46,USA
full_time,Senior Desarrollador Java,Adzuna,67999.0,No especificado,"Python, JavaScript, Java, Go, Scala, R, AWS, Azure, GCP, Docker, Kubernetes, Machine Learning, AI, DevOps, CI/CD, Microservices, API, Git",2025-05-29T18:50:21,Portugal
full_time,Senior Administrador AWS,Jooble,37333.0,No especificado,"Python, Go, Kotlin, Scala, R, AWS, Kubernetes, Jenkins, GitHub Actions, Terraform, Ansible, AI, DevOps, CI/CD, REST, API, SPA, Excel, Git",2025-05-29T00:50:21,LATAM
full_time,Semi Senior Product Owner,Jooble,75924.0,No especificado,"Go, TypeScript, Scala, R, React, Angular, Docker, Kubernetes, AI, REST, API, Frontend, Backend, SPA",2025-05-28T16:50:12,"Germany, Spain"
full_time,Lead Desarrollador Java,Adzuna,51483.0,No especificado,"Python, Java, C#, C++, Go, Scala, Rust, R, SQL, Express, AWS, Azure, GCP, Docker, Kubernetes, AI, CI/CD, API, Backend, SPA",2025-05-27T14:50:59,USA
full_time,Senior Administrador de Bases de Datos,Adzuna,77826.0,No especificado,"Python, JavaScript, Java, C++, Go, Scala, R, React, AWS, Azure, GCP, Docker, Kubernetes, Jenkins, GitLab, AI, DevOps, CI/CD, Agile, Scrum, API, JSON, XML, Backend, TDD, BDD, Excel, JIRA, Confluence, Git",2025-05-26T20:51:55,USA
full_time,Junior Científico de Datos,Adzuna,50512.0,No especificado,"R, Elasticsearch, Kubernetes, AI, CI/CD, REST, API, Hadoop, Excel, Git",2025-05-26T20:51:11,Ireland
full_time,Semi Senior Analista de BI,Adzuna,56012.0,No especificado,"Java, Go, Kotlin, Scala, R, SQL, Spring, Express, PostgreSQL, Kubernetes, AI, REST, API, Frontend, Backend, SPA, Git",2025-05-26T14:50:12,"USA, Canada"
full_time,Lead Cloud Engineer,Jooble,61531.0,No especificado,"Python, C#, C++, Go, TypeScript, R, React, ASP.NET, Rails, AWS, Azure, GCP, GitHub Actions, Machine Learning, AI, DevOps, CI/CD, REST, API, Frontend, Backend, SPA, Excel, JIRA, Git",2025-05-25T22:50:54,Europe
full_time,Semi Senior Arquitecto de Software,Jooble,69828.0,No especificado,"Go, R, Express, AWS, AI, API, SPA",2025-05-25T20:50:48,USA
full_time,Junior Ingeniero en IA,Jooble,73786.0,No especificado,"C++, Go, Scala, Rust, R, Kubernetes, AI, DevOps, Microservices, API, SPA, Git",2025-05-25T00:50:53,Europe
full_time,Semi Senior Cloud Engineer,Jooble,47039.0,No especificado,"Go, Scala, R, React, AWS, AI, REST, API",2025-05-24T18:50:21,"LATAM, USA, Canada"
full_time,Junior Ingeniero de Redes,Adzuna,72055.0,No especificado,"Go, Rust, R, Express, AI, Agile, API, SPA, Git",2025-05-24T10:50:29,USA
full_time,Senior Product Owner,Adzuna,45945.0,No especificado,"Python, R, AI, REST, API, SPA, Git",2025-05-24T02:51:02,USA
full_time,Semi Senior Ingeniero de Machine Learning,Adzuna,31774.0,No especificado,"Python, JavaScript, Java, PHP, Go, R, SQL, React, Vue, Spring, Laravel, MySQL, MongoDB, Redis, Azure, Google Cloud, Kubernetes, AI, CI/CD, API, Backend, SPA",2025-05-24T02:50:46,Australia
full_time,Semi Senior Ingeniero de Machine Learning,Adzuna,42835.0,No especificado,"TypeScript, Scala, R, Express, Rails, AI, API, Backend",2025-05-23T22:50:41,USA
full_time,Semi Senior Ingeniero en IA,Adzuna,44323.0,No especificado,"Go, R, AI, API, Excel",2025-05-23T20:51:21,Worldwide
full_time,Junior Administrador de Bases de Datos,Adzuna,60041.0,No especificado,"Python, C++, Go, R, GCP, AI, REST, API, SPA, Excel, Git",2025-05-23T02:50:33,USA
contract,Senior Desarrollador Java,Adzuna,29096.0,No especificado,"Python, Go, Scala, Rust, R, AWS, Google Cloud, GCP, Kubernetes, GitLab, GitHub Actions, AI, CI/CD, API, SPA, Excel, Git",2025-05-22T20:50:37,LATAM
full_time,Lead Ingeniero en IA,Adzuna,35470.0,No especificado,"R, AI, REST, API, SPA, Git",2025-05-22T16:50:46,Europe
full_time,Senior Desarrollador Backend,Jooble,61361.0,No especificado,"Java, Kotlin, Scala, R, SQL, AI, API, SPA, Excel",2025-05-21T22:50:59,USA
full_time,Semi Senior Ingeniero de QA,Jooble,72819.0,No especificado,"Rust, R, Express, AI, API, SPA",2025-05-21T14:51:22,Ireland
full_time,Junior Site Reliability Engineer,Jooble,28272.0,No especificado,"Python, Go, Rust, R, SQL, Machine Learning, AI, API, SPA, Excel",2025-05-21T02:51:40,USA
full_time,Junior Especialista en Ciberseguridad,Jooble,28386.0,No especificado,"Python, JavaScript, Java, C#, Go, TypeScript, Scala, R, SQL, AWS, Azure, GCP, Machine Learning, AI, API, UI/UX, SPA, Excel",2025-05-21T02:51:09,Spain
full_time,Junior Desarrollador Python,Jooble,75812.0,No especificado,"C++, Go, Scala, Rust, R, AI, API",2025-05-20T18:50:37,"Europe, UK"
full_time,Senior Desarrollador Backend,Jooble,26910.0,No especificado,"Go, Rust, R, Azure, Docker, Terraform, Ansible, AI, DevOps, CI/CD, Agile, API, SPA, Git",2025-05-20T16:51:17,Serbia
contract,Junior Ingeniero DevOps,Adzuna,54130.0,No especificado,"Python, Go, Scala, R, AWS, Google Cloud, GCP, Docker, Kubernetes, Terraform, AI, DevOps, CI/CD, Agile, API, SPA, Excel, JIRA, Confluence, Git, Linux",2025-05-20T06:51:25,Mexico
full_time,Junior Desarrollador Full Stack,Adzuna,42771.0,No especificado,"PHP, Go, Ruby, Rust, R, Rails, AI, API, SPA",2025-05-20T06:50:50,UK
full_time,Junior Desarrollador Mobile,Jooble,51253.0,No especificado,"Python, JavaScript, Java, Go, TypeScript, Scala, Rust, R, React, Angular, Vue, AWS, Azure, GCP, Docker, Kubernetes, AI, Agile, API, Excel, Git",2025-05-19T22:51:03,"Europe, USA, Canada"
full_time,Senior Desarrollador .NET,Jooble,45378.0,No especificado,"Python, Go, Scala, Rust, R, AWS, Azure, GCP, Docker, Kubernetes, Machine Learning, AI, Deep Learning, CI/CD, Microservices, API, Frontend, Backend, SPA, Excel",2025-05-19T22:51:02,India
full_time,Senior Ingeniero de Software,Jooble,53698.0,No especificado,"Go, Rust, R, AI, REST, API, SPA, Excel, Git",2025-05-19T12:50:06,USA
full_time,Lead Desarrollador Mobile,Jooble,58167.0,No especificado,"JavaScript, Java, Go, Ruby, TypeScript, Scala, Rust, R, Oracle, AWS, Azure, Jenkins, GitHub Actions, AI, CI/CD, Agile, REST, API, Git",2025-05-18T16:51:12,USA
full_time,Senior Analista de BI,Adzuna,78474.0,No especificado,"C#, PHP, Scala, R, SQL, React, Laravel, MySQL, PostgreSQL, Redis, Docker, AI, CI/CD, Agile, REST, Microservices, API, Frontend, Backend, Excel, Git",2025-06-14T14:50:47,"USA, Canada"
full_time,Senior Desarrollador Blockchain,Jooble,31549.0,No especificado,"Go, Scala, R, React, Angular, AI, REST, API, Frontend, SPA, Excel",2025-05-07T02:50:55,USA
full_time,Lead Administrador de Sistemas,Jooble,31591.0,No especificado,"Go, Scala, R, AI, Agile, API, Frontend, JIRA, Confluence, Git",2025-05-03T08:51:16,UK
full_time,Senior Desarrollador Frontend,Adzuna,42892.0,No especificado,"JavaScript, Java, PHP, Go, TypeScript, R, React, Vue, AI, DevOps, Scrum, REST, API, Frontend, Backend, SPA, Git",2025-04-01T18:50:56,Poland
full_time,Junior Administrador de Sistemas,Adzuna,39702.0,No especificado,"Python, Go, Scala, R, SQL, AI, Agile, API, Frontend, Backend",2025-06-15T10:50:52,Turkey
full_time,Junior Administrador AWS,Jooble,69525.0,No especificado,"Python, Java, Go, TypeScript, Rust, R, Express, DynamoDB, AWS, Terraform, AI, REST, API, Backend, SPA, Excel",2025-05-17T22:50:59,Mexico
full_time,Lead Administrador de Sistemas,Adzuna,38624.0,No especificado,"C#, Go, Scala, R, SQL, PostgreSQL, Redis, AWS, Kubernetes, Terraform, AI, CI/CD, REST, GraphQL, API, Backend, Git",2025-05-17T20:51:20,Canada
full_time,Senior Product Owner,Adzuna,54991.0,No especificado,"Swift, Scala, Rust, R, AI, Agile, REST, GraphQL, API, Backend, Excel, Git",2025-05-09T00:50:18,India
full_time,Lead Technical Lead,Jooble,57504.0,No especificado,"Java, Go, Swift, Kotlin, TypeScript, Scala, R, React, Angular, Express, Flutter, MongoDB, Redis, Firebase, AWS, Docker, AI, Scrum, REST, Microservices, API, UI/UX, Backend, SPA, Git",2025-04-11T06:51:01,LATAM
full_time,Lead Desarrollador Frontend,Adzuna,38569.0,No especificado,"JavaScript, Java, Go, Ruby, Swift, TypeScript, R, SQL, React, Rails, Flutter, PostgreSQL, AWS, Docker, Terraform, AI, CI/CD, Agile, Scrum, API, Frontend, Backend, Excel, Git",2025-04-04T20:51:04,Poland
full_time,Lead Desarrollador Python,Jooble,49154.0,No especificado,"Go, Swift, Rust, R, Express, Machine Learning, AI, API, SPA",2025-06-17T12:51:11,USA
internship,Senior Ingeniero de Redes,Adzuna,33626.0,No especificado,"Python, Java, Go, R, Machine Learning, AI, API, SPA, Excel",2025-06-17T12:50:44,USA
full_time,Lead Científico de Datos,Jooble,45304.0,No especificado,"R, Express, Rails, Machine Learning, AI, REST, API, SPA, Git",2025-06-17T02:51:03,India
full_time,Junior Desarrollador Python,Adzuna,60567.0,No especificado,"Python, R, SQL, Machine Learning, AI, API",2025-06-15T16:51:19,USA
full_time,Junior Ingeniero de Redes,Adzuna,41751.0,No especificado,"Python, Java, Go, R, Machine Learning, AI, Deep Learning, API, SPA, Hadoop, Spark, Git",2025-06-15T02:50:09,India
contract,Semi Senior Ingeniero de Software,Adzuna,65751.0,No especificado,"Python, Go, R, Machine Learning, AI, REST, API, SPA, Excel",2025-06-14T14:50:49,LATAM
contract,Junior Desarrollador Java,Jooble,78381.0,No especificado,"Go, R, Machine Learning, AI, Agile, Scrum, API, SPA",2025-06-13T14:50:55,Canada
full_time,Lead Ingeniero en IA,Jooble,28514.0,No especificado,"Python, Go, R, Express, GCP, Machine Learning, AI, Deep Learning, Agile, Microservices, API, SPA, Excel",2025-06-12T18:50:05,USA
full_time,Senior Analista de Datos,Adzuna,46799.0,No especificado,"Python, Go, Rust, R, SQL, AWS, Machine Learning, AI, DevOps, API",2025-06-12T14:50:17,USA
full_time,Junior Desarrollador React,Jooble,28302.0,No especificado,"Python, Go, Scala, Rust, R, Kubernetes, GitLab, Terraform, Machine Learning, AI, CI/CD, REST, API, SPA, Excel, Git",2025-06-12T08:50:20,"Europe, UK"
full_time,Junior Analista de Datos,Adzuna,73586.0,No especificado,"Python, JavaScript, Java, Go, TypeScript, Scala, R, SQL, React, Django, Flask, Next.js, FastAPI, AWS, Azure, GCP, Docker, Kubernetes, Machine Learning, AI, REST, API, Frontend, Backend, Excel, Git",2025-06-12T02:50:41,"Spain, Azerbaijan"
contract,Senior Technical Lead,Adzuna,49064.0,No especificado,"Python, R, SQL, AWS, Machine Learning, AI, Agile, API, Tableau, Excel, JIRA, Confluence, Git",2025-06-11T10:50:45,"Georgia, Russia, Kazakhstan"
full_time,Lead Administrador AWS,Jooble,43309.0,No especificado,"Go, Rust, R, AWS, Machine Learning, AI, API, SPA",2025-06-11T06:50:37,USA
full_time,Semi Senior Desarrollador Blockchain,Jooble,63271.0,No especificado,"Go, R, Machine Learning, AI, API, SPA",2025-06-10T12:51:06,USA
full_time,Lead Científico de Datos,Jooble,77609.0,No especificado,"Python, Go, R, Machine Learning, AI, Deep Learning, REST, API, Excel",2025-06-10T08:50:52,Brazil
full_time,Senior Ingeniero en IA,Adzuna,42553.0,No especificado,"Python, Go, R, React, AWS, GitLab, Machine Learning, AI, CI/CD, REST, API, SPA, JIRA, Confluence, Git",2025-06-09T16:51:31,Europe
full_time,Semi Senior Científico de Datos,Jooble,46631.0,No especificado,"Python, Java, Go, R, Machine Learning, AI, Deep Learning, Agile, API, SPA, Hadoop, Spark, Excel, Git",2025-06-09T00:50:57,India
full_time,Semi Senior Administrador AWS,Adzuna,59810.0,No especificado,"Python, Go, Scala, R, SQL, Express, MySQL, Oracle, Redis, AWS, Azure, GCP, Docker, Kubernetes, Jenkins, Terraform, Ansible, Machine Learning, AI, CI/CD, API, Excel, Git, Linux",2025-06-09T00:50:49,Costa Rica
full_time,Senior Especialista DevSecOps,Adzuna,49570.0,No especificado,"Go, Rust, R, Machine Learning, AI, CI/CD, REST, API, Frontend, Backend, SPA, Excel",2025-06-07T04:50:50,USA
full_time,Semi Senior Ingeniero DevOps,Adzuna,32836.0,No especificado,"Python, Go, Scala, Rust, R, SQL, Express, AWS, Azure, GCP, Machine Learning, AI, Agile, API, SPA, Tableau, Power BI",2025-06-05T10:50:42,USA
contract,Semi Senior Desarrollador Mobile,Jooble,52889.0,No especificado,"Python, Go, Swift, Scala, Rust, R, SQL, PostgreSQL, AWS, Docker, Kubernetes, Machine Learning, AI, API, SPA",2025-06-05T04:51:23,"USA, Ireland, Spain"
full_time,Semi Senior Desarrollador React,Jooble,44048.0,No especificado,"Python, JavaScript, Java, Go, TypeScript, R, SQL, React, Express, PostgreSQL, Azure, Terraform, Machine Learning, AI, GraphQL, API",2025-06-03T16:50:47,"USA, Canada"
full_time,Lead Desarrollador Java,Adzuna,69367.0,No especificado,"Python, Go, Scala, R, Express, AWS, Azure, Google Cloud, Kubernetes, Machine Learning, AI, API, Excel, Linux",2025-06-02T16:50:47,USA
part_time,Semi Senior Desarrollador Java,Jooble,63456.0,No especificado,"Go, R, AWS, Machine Learning, AI, API, Excel, Git",2025-06-01T08:50:51,USA
full_time,Senior Administrador de Bases de Datos,Adzuna,31806.0,No especificado,"Go, R, Machine Learning, AI, API, SPA, Excel",2025-06-01T02:51:19,USA
freelance,Semi Senior Scrum Master,Adzuna,50268.0,No especificado,"Go, R, Machine Learning, AI, API, Excel, Git",2025-05-30T14:28:58,USA
full_time,Junior Product Owner,Jooble,44562.0,No especificado,"Go, Rust, R, Express, AWS, Machine Learning, AI, REST, API, SPA, Git",2025-05-30T06:50:44,USA
full_time,Senior Analista de Datos,Jooble,27586.0,No especificado,"Go, R, Express, Firebase, Azure, Machine Learning, AI, DevOps, REST, API, SPA, Excel, JIRA, Confluence, Git",2025-05-30T04:51:01,Spain
full_time,Lead Desarrollador Blockchain,Jooble,39805.0,No especificado,"Python, Go, Scala, R, AWS, Azure, Jenkins, GitHub Actions, Terraform, Machine Learning, AI, CI/CD, API, Git",2025-05-29T16:50:15,UK
full_time,Lead Desarrollador Java,Jooble,51543.0,No especificado,"R, Machine Learning, AI, API",2025-05-28T22:50:18,Worldwide
full_time,Senior Ingeniero de Software,Jooble,59628.0,No especificado,"Python, Go, Rust, R, Azure, Machine Learning, AI, API, Backend, Excel",2025-05-28T16:50:14,Worldwide
full_time,Junior Site Reliability Engineer,Jooble,55406.0,No especificado,"Go, R, Spring, Express, AWS, Machine Learning, AI, REST, API, SPA, Excel",2025-05-26T20:51:24,USA
contract,Semi Senior Especialista en Ciberseguridad,Adzuna,69340.0,No especificado,"Python, Go, Scala, R, SQL, AWS, Machine Learning, AI, API, SPA, ETL, Spark, Excel",2025-05-26T14:50:11,Mexico
full_time,Junior Administrador de Sistemas,Jooble,58587.0,No especificado,"Python, Go, Scala, R, AWS, Kubernetes, GitHub Actions, Terraform, Ansible, Machine Learning, AI, CI/CD, API, SPA, Git, Linux",2025-05-25T22:50:54,USA
contract,Junior Site Reliability Engineer,Adzuna,25852.0,No especificado,"Python, Go, Rust, R, AWS, GCP, Docker, Kubernetes, Jenkins, Terraform, Machine Learning, AI, DevOps, CI/CD, Scrum, REST, API, Backend, Git, Linux",2025-05-24T04:51:14,USA
full_time,Senior Desarrollador Blockchain,Adzuna,29395.0,No especificado,"Python, Go, Scala, Rust, R, AWS, Google Cloud, GCP, Kubernetes, Terraform, Machine Learning, AI, DevOps, CI/CD, REST, API, SPA, Git",2025-05-24T02:51:10,USA
full_time,Senior Site Reliability Engineer,Adzuna,46251.0,No especificado,"Go, R, Machine Learning, AI, API, SPA",2025-05-23T20:50:23,USA
full_time,Senior Desarrollador Java,Jooble,62004.0,No especificado,"Go, R, Express, Machine Learning, AI, REST, API, SPA, Spark, Git",2025-05-23T08:51:02,USA
full_time,Junior Product Owner,Jooble,59559.0,No especificado,"Scala, R, Vue, Express, Machine Learning, AI, API, SPA, Tableau, Looker, Excel",2025-05-23T06:50:47,Philippines
