tipo_contrato,puesto,fuente,salario_promedio,empresa,tecnologias,fecha_publicacion,ubicacion
full_time,Senior Arquitecto de Software,Adzuna,42163.0,No especificado,"Go, R, MongoDB, AI, REST, API, SPA, Git",2025-05-31T00:51:17,USA
contract,Junior Científico de Datos,Jooble,28049.0,No especificado,"Python, Go, Scala, R, Redis, Elasticsearch, Docker, Ansible, AI, REST, API, SPA, Excel, Linux",2025-05-30T12:50:39,Europe
full_time,Semi Senior Desarrollador Backend,Adzuna,37870.0,No especificado,"Go, R, SQL, AI, API, SPA, Tableau",2025-05-28T00:51:08,USA
full_time,Junior Arquitecto de Software,Jooble,28104.0,No especificado,"Go, Scala, R, AWS, AI, API",2025-05-23T12:51:10,USA
full_time,Lead Cloud Engineer,Adzuna,73085.0,No especificado,"Go, R, AI, REST, API, SPA, Excel",2025-05-22T18:50:53,USA
full_time,Semi Senior Desarrollador .NET,Adzuna,69643.0,No especificado,"Go, Rust, R, AWS, AI, REST, API, Excel",2025-05-21T14:50:58,USA
full_time,Junior Desarrollador Java,Adzuna,61465.0,No especificado,"Go, R, MongoDB, AI, REST, API, Git",2025-05-20T20:50:21,USA
full_time,Lead Ingeniero DevOps,Jooble,33710.0,No especificado,"Go, R, Express, AWS, Azure, AI, REST, API, SPA, Excel",2025-05-19T10:50:49,USA
contract,Junior Ingeniero de Software,Adzuna,74385.0,No especificado,"Rust, R, AI, API, SPA, Excel",2025-05-17T16:50:43,Japan
full_time,Senior Desarrollador Full Stack,Jooble,77887.0,No especificado,"Python, Go, Rust, R, SQL, AI, API",2025-05-17T02:50:19,USA
full_time,Lead Ingeniero de Redes,Adzuna,51152.0,No especificado,"R, AI, API, SPA, Excel",2025-05-14T02:51:38,USA
full_time,Senior Ingeniero DevOps,Adzuna,30274.0,No especificado,"Python, Go, Scala, Rust, R, Azure, AI, API, SPA, Excel",2025-05-13T14:51:04,USA
full_time,Senior Ingeniero de Software,Adzuna,62225.0,No especificado,"Go, R, AI, REST, API",2025-05-09T22:50:35,Philippines
full_time,Senior Ingeniero de QA,Adzuna,47400.0,No especificado,"Go, Rust, R, AI, REST, API, SPA, Excel",2025-05-09T04:51:14,USA
full_time,Lead Desarrollador Full Stack,Jooble,34206.0,No especificado,"Python, Go, R, Express, AWS, Azure, GCP, Kubernetes, Terraform, Ansible, AI, CI/CD, Agile, API, Linux",2025-05-06T00:50:54,EMEA
full_time,Lead Desarrollador Full Stack,Adzuna,65741.0,No especificado,"Python, Go, Scala, R, AWS, Azure, Google Cloud, Docker, Kubernetes, Terraform, Ansible, AI, DevOps, CI/CD, API",2025-05-02T18:51:25,Ukraine
full_time,Lead Product Owner,Adzuna,53582.0,No especificado,"Go, R, AWS, AI, API, SPA, Excel, Git",2025-05-02T16:50:58,USA
full_time,Semi Senior Administrador AWS,Jooble,61355.0,No especificado,"Go, Scala, Rust, R, SQL, AWS, Azure, GCP, Machine Learning, AI, API, ETL, Tableau, Looker, Excel",2025-04-29T22:51:11,Canada
full_time,Junior Desarrollador Python,Jooble,58233.0,No especificado,"Go, Rust, R, AWS, GCP, AI, API, SPA, Git",2025-04-28T12:50:07,Europe
full_time,Senior Arquitecto de Software,Jooble,35795.0,No especificado,"Scala, Rust, R, AWS, Azure, GCP, GitLab, Terraform, Ansible, Machine Learning, AI, DevOps, Agile, Microservices, API, SPA, Excel, Git",2025-04-27T18:50:45,USA
full_time,Senior Desarrollador React,Jooble,48159.0,No especificado,"Python, R, Express, AI, API, SPA, Excel",2025-04-25T12:51:09,USA
full_time,Semi Senior Desarrollador Blockchain,Adzuna,45526.0,No especificado,"Go, Rust, R, Google Cloud, GCP, AI, DevOps, Agile, REST, API, SPA, Excel, macOS",2025-04-25T02:50:59,USA
full_time,Semi Senior Científico de Datos,Jooble,70506.0,No especificado,"JavaScript, Java, C#, Go, TypeScript, Scala, R, Express, Kubernetes, GitHub Actions, AI, CI/CD, API, SPA, Git",2025-04-24T22:51:14,Canada
full_time,Semi Senior Desarrollador React,Adzuna,56758.0,No especificado,"Python, Java, Go, Rust, R, AWS, Azure, GCP, Docker, Kubernetes, Terraform, AI, DevOps, REST, API, SPA",2025-04-24T16:50:19,USA
full_time,Senior Científico de Datos,Jooble,39870.0,No especificado,"Go, Rust, R, Machine Learning, AI, API, SPA, Excel, Git",2025-04-21T22:50:56,India
full_time,Lead Desarrollador Frontend,Adzuna,32831.0,No especificado,"Python, Go, R, SQL, AWS, Azure, GCP, Docker, Kubernetes, AI, REST, API, Backend, SPA, JIRA, Git",2025-04-20T08:50:16,USA
full_time,Junior Cloud Engineer,Adzuna,78590.0,No especificado,"Go, R, AI, API, SPA, Tableau, Power BI, Excel, Git",2025-04-17T10:51:31,Japan
full_time,Senior Desarrollador .NET,Adzuna,62220.0,No especificado,"Python, C++, Go, R, Azure, AI, API, Excel, Git, Windows, macOS",2025-04-04T02:51:03,USA
full_time,Lead Product Owner,Jooble,72649.0,No especificado,"Go, Scala, Rust, R, AI, API, Excel",2025-03-28T08:51:32,Japan
contract,Lead Desarrollador Full Stack,Jooble,58176.0,No especificado,"Go, R, SQL, AI, API, Tableau, Excel, Git",2025-06-10T20:50:58,Poland
full_time,Junior Desarrollador React,Adzuna,70541.0,No especificado,"Python, Go, Rust, R, SQL, AI, API, SPA, Tableau, Power BI, Looker",2025-06-09T12:50:56,"USA, Canada"
full_time,Junior Scrum Master,Adzuna,58485.0,No especificado,"R, SQL, AI, Agile, API, Excel",2025-06-08T10:50:55,Spain
full_time,Senior Administrador de Sistemas,Jooble,66549.0,No especificado,"Go, R, SQL, DynamoDB, AWS, AI, REST, API, SPA, Tableau, Excel, Windows",2025-06-05T18:50:37,USA
full_time,Senior Desarrollador Full Stack,Adzuna,72724.0,No especificado,"Go, Scala, R, SQL, AI, REST, API, SPA, Tableau, Power BI, Looker, Excel",2025-06-02T12:50:45,USA
full_time,Junior Ingeniero de Software,Jooble,41740.0,No especificado,"Go, Scala, R, SQL, AI, API, ETL, Excel, Git",2025-06-02T08:50:31,USA
full_time,Semi Senior Product Owner,Jooble,56571.0,No especificado,"Python, Go, Scala, Rust, R, SQL, GitLab, AI, REST, API, ETL, JIRA, Git",2025-06-01T12:50:13,Europe
full_time,Junior Technical Lead,Jooble,67114.0,No especificado,"Python, Go, R, SQL, Express, MySQL, PostgreSQL, SQL Server, Oracle, Azure, AI, Agile, API, Tableau",2025-05-30T02:51:40,USA
full_time,Lead Desarrollador Full Stack,Jooble,58926.0,No especificado,"Go, Rust, R, Express, Google Cloud, AI, API, SPA, ETL, Spark, Excel",2025-05-30T02:51:18,USA
full_time,Lead Analista de Datos,Jooble,42985.0,No especificado,"Go, Scala, Rust, R, SQL, AI, API, SPA, Tableau, Excel",2025-05-28T22:51:17,Germany
full_time,Semi Senior Desarrollador Backend,Adzuna,59458.0,No especificado,"Python, Go, Scala, Rust, R, SQL, Azure, AI, API, SPA, ETL, Hadoop, Spark, Power BI, Excel",2025-05-21T02:51:41,Europe
contract,Lead Administrador de Sistemas,Jooble,30754.0,No especificado,"Python, Go, Scala, R, SQL, AI, API, SPA, Tableau, Looker, Git",2025-05-16T00:50:35,Canada
full_time,Semi Senior Ingeniero en IA,Adzuna,26727.0,No especificado,"Python, Go, R, SQL, AI, REST, API, SPA, Looker, Excel, Git",2025-05-13T20:51:44,"USA, Canada"
full_time,Senior Administrador AWS,Adzuna,39336.0,No especificado,"Python, Go, R, SQL, AI, REST, API, Excel",2025-05-08T18:51:00,"Philippines, Vietnam"
full_time,Senior Cloud Engineer,Adzuna,39650.0,No especificado,"Go, Scala, Rust, R, Express, AWS, AI, REST, API, SPA",2025-05-04T16:50:56,USA
contract,Junior Especialista en UX/UI,Adzuna,57091.0,No especificado,"Go, R, SQL, AI, API, Tableau, Power BI",2025-05-01T18:50:14,UK
full_time,Junior Especialista DevSecOps,Adzuna,39896.0,No especificado,"Python, Go, R, SQL, Express, AWS, Machine Learning, AI, REST, API, Excel, Git",2025-04-25T12:51:34,Mexico
full_time,Senior Administrador AWS,Jooble,39745.0,No especificado,"Python, Go, Rust, R, SQL, Express, AI, API, SPA, Excel",2025-04-24T06:50:47,Brazil
full_time,Semi Senior Desarrollador .NET,Adzuna,49389.0,No especificado,"Python, Go, R, AI, API, SPA, Spark, Tableau",2025-04-17T06:51:25,Asia
full_time,Semi Senior Administrador AWS,Jooble,75960.0,No especificado,"Python, Go, Rust, R, SQL, Express, AI, REST, API, SPA, Excel",2025-04-15T08:50:33,India
full_time,Lead Desarrollador Frontend,Adzuna,57039.0,No especificado,"Python, Go, R, SQL, Machine Learning, AI, API, ETL, Tableau, Power BI, Looker",2025-04-14T06:50:58,Ukraine
full_time,Junior Site Reliability Engineer,Adzuna,59002.0,No especificado,"Python, Go, Scala, R, SQL, AI, API, Tableau, Power BI, Looker, Excel",2025-04-13T08:51:17,South Africa
full_time,Junior Especialista DevSecOps,Jooble,58353.0,No especificado,"Go, TypeScript, Rust, R, React, AWS, Azure, Google Cloud, AI, REST, API, Backend, SPA, Git",2025-04-12T06:51:48,"UK, Portugal, Poland, South Africa, Romania, Spain"
full_time,Senior Ingeniero de Redes,Adzuna,30842.0,No especificado,"Python, Go, Scala, R, SQL, AWS, Machine Learning, AI, API, SPA, Tableau, Power BI, Excel",2025-04-04T02:51:03,USA
full_time,Senior Administrador de Sistemas,Jooble,73678.0,No especificado,"Go, Scala, R, SQL, Express, AWS, AI, API, SPA, ETL, Tableau, Looker",2025-04-04T00:50:04,USA
full_time,Semi Senior Especialista en UX/UI,Jooble,66059.0,No especificado,"Go, Scala, R, SQL, Express, AI, REST, API, Tableau, Power BI, Excel",2025-03-24T04:50:40,LATAM
No especificado,Lead Especialista DevSecOps,Jooble,52167.0,Unknown Company,R,2021-07-03,Location not specified
full_time,Semi Senior Administrador AWS,Jooble,62038.0,No especificado,"C#, Go, R, AI, API, Git",2025-05-16T20:50:07,Ukraine
full_time,Senior Technical Lead,Adzuna,67110.0,No especificado,"C#, Scala, R, AWS, Azure, Docker, Kubernetes, AI, CI/CD, Agile, Microservices, API, SPA, Excel",2025-04-16T08:51:00,"Americas, LATAM"
full_time,Senior Analista de Datos,Jooble,58152.0,No especificado,"JavaScript, Java, Go, Scala, Rust, R, React, AWS, AI, Agile, API, Frontend, Backend, SPA, Git",2025-06-17T12:50:40,USA
full_time,Semi Senior Administrador de Sistemas,Adzuna,34171.0,No especificado,"Go, Scala, Rust, R, AI, API, Excel, Git",2025-06-13T04:51:27,UK
contract,Lead Desarrollador Full Stack,Jooble,62284.0,No especificado,"JavaScript, Java, Go, R, AI, REST, API, Git",2025-06-08T04:51:38,Indonesia
contract,Lead Desarrollador React,Adzuna,73986.0,No especificado,"Go, Scala, R, AI, Agile, Scrum, REST, API, JIRA, Git",2025-06-06T22:50:32,USA
full_time,Semi Senior Desarrollador Backend,Jooble,37658.0,No especificado,"Python, JavaScript, Java, Go, Scala, R, AI, Agile, Scrum, API, UI/UX, Excel, Git",2025-06-05T10:50:56,Philippines
full_time,Semi Senior Desarrollador Frontend,Adzuna,59363.0,No especificado,"Python, Go, R, Express, AI, API, Backend, Full Stack, JIRA",2025-06-04T18:51:36,Europe
full_time,Lead Ingeniero de Machine Learning,Jooble,39939.0,No especificado,"Go, TypeScript, Scala, Rust, R, SQL, React, PostgreSQL, AWS, AI, CI/CD, API, SPA, JIRA, Git",2025-05-30T02:52:17,Mexico
full_time,Junior Especialista DevSecOps,Jooble,38021.0,No especificado,"Python, Go, R, SQL, AI, Agile, REST, API, SPA, Excel, JIRA",2025-05-27T20:51:50,Bulgaria
full_time,Senior Desarrollador .NET,Adzuna,48017.0,No especificado,"JavaScript, Java, Go, TypeScript, Scala, R, Angular, AWS, Jenkins, AI, CI/CD, API, Frontend, Backend, SPA, Excel",2025-05-24T16:50:43,USA
full_time,Junior Ingeniero de Machine Learning,Adzuna,61685.0,No especificado,"Go, R, SQL, Agile, API, SPA",2025-05-23T14:50:50,India
full_time,Semi Senior Desarrollador Java,Jooble,32377.0,No especificado,"Java, C#, Go, R, SQL, Express, Jenkins, AI, Agile, Scrum, API, SPA, Git",2025-05-22T14:51:22,Costa Rica
contract,Senior Analista de Datos,Jooble,67599.0,No especificado,"R, AI, API, Excel",2025-05-17T20:51:37,"Europe, Asia, South America"
full_time,Lead Administrador de Bases de Datos,Jooble,63218.0,No especificado,"Go, Rust, R, AI, API, SPA, Excel",2025-05-15T18:51:04,Nepal
full_time,Semi Senior Desarrollador Full Stack,Adzuna,40859.0,No especificado,"JavaScript, Java, R, AI, Agile, Scrum, API, SPA, Git",2025-05-11T10:50:36,LATAM
full_time,Junior Desarrollador Frontend,Adzuna,64527.0,No especificado,"R, AI, Scrum, REST, API, SPA, JIRA, Confluence",2025-05-09T14:50:44,Ukraine
full_time,Senior Analista de Datos,Jooble,43542.0,No especificado,"Go, R, AI, REST, API, SPA, Excel, Git",2025-05-09T06:50:50,European timezones
full_time,Senior Administrador AWS,Jooble,37280.0,No especificado,"Java, Go, R, Angular, AWS, Azure, Docker, AI, CI/CD, Agile, Scrum, REST, Microservices, API, SPA, Spark, Excel, Git",2025-05-08T20:50:12,Costa Rica
full_time,Semi Senior Desarrollador .NET,Jooble,58776.0,No especificado,"C#, Go, Scala, R, SQL, MySQL, PostgreSQL, MongoDB, Docker, GitLab, AI, CI/CD, Agile, REST, Microservices, API, SPA, Git",2025-05-07T02:51:52,Worldwide
full_time,Senior Científico de Datos,Jooble,56181.0,No especificado,"Python, Ruby, Scala, Rust, R, SQL, Express, AWS, Azure, Docker, Kubernetes, Jenkins, Ansible, AI, DevOps, CI/CD, Microservices, API, SPA, Git",2025-05-06T00:50:53,USA
full_time,Senior Analista de BI,Adzuna,66415.0,No especificado,"R, AI, Agile, Scrum, REST, API, Excel, JIRA",2025-05-04T02:51:01,Europe
contract,Junior Desarrollador .NET,Jooble,25924.0,No especificado,"JavaScript, Java, Go, R, Flutter, AI, API, SPA, JIRA, Git",2025-05-03T10:50:36,Northern America
full_time,Junior Especialista en UX/UI,Adzuna,65415.0,No especificado,"Scala, R, SQL, AI, CI/CD, Agile, API, JIRA",2025-05-01T22:51:10,"Europe, UK"
full_time,Semi Senior Cloud Engineer,Jooble,25430.0,No especificado,"C#, Scala, R, SQL, AI, REST, API, SPA, JIRA, Git",2025-04-30T22:50:51,USA
full_time,Lead Technical Lead,Jooble,66424.0,No especificado,"Java, Go, Kotlin, R, SQL, PostgreSQL, Kubernetes, GitHub Actions, AI, CI/CD, REST, API, JIRA, Git",2025-04-27T20:50:07,Turkey
full_time,Senior Ingeniero de QA,Jooble,56227.0,No especificado,"Go, Rust, R, AI, CI/CD, API, SPA, Excel",2025-04-20T16:51:35,"Portugal, Georgia, Spain, Serbia, Armenia"
full_time,Semi Senior Especialista en UX/UI,Adzuna,47877.0,No especificado,"Go, TypeScript, R, AI, Agile, API, SPA, Excel, JIRA, Git",2025-04-18T10:51:00,Mexico
full_time,Senior Científico de Datos,Adzuna,54668.0,No especificado,"Python, Go, Swift, Scala, R, Express, Docker, Jenkins, AI, CI/CD, API, SPA, Excel, Git",2025-04-16T08:51:45,USA
contract,Lead Especialista en UX/UI,Jooble,48147.0,No especificado,"Go, Scala, R, AI, Agile, Scrum, API, Git",2025-04-13T08:51:33,Poland
full_time,Junior Desarrollador Blockchain,Jooble,65281.0,No especificado,"TypeScript, Scala, R, React, AI, CI/CD, API, TDD, BDD, Excel",2025-04-11T08:51:26,USA
contract,Semi Senior Cloud Engineer,Adzuna,62687.0,No especificado,"JavaScript, Java, Go, TypeScript, Scala, R, AI, Agile, REST, API, SPA, Excel",2025-03-31T22:50:34,Vietnam
full_time,Junior Scrum Master,Adzuna,54892.0,No especificado,"Rust, R, Express, AWS, AI, API, SPA, Excel",2025-06-12T18:50:17,India
full_time,Semi Senior Ingeniero DevOps,Jooble,71841.0,No especificado,"Go, Rust, R, Express, AI, REST, API, Excel",2025-06-10T18:50:46,USA
full_time,Junior Administrador AWS,Jooble,61842.0,No especificado,"Go, R, AWS, AI, REST, API, SPA, Excel, Git",2025-06-06T12:50:47,USA
full_time,Lead Administrador AWS,Jooble,71180.0,No especificado,"Go, Scala, Rust, R, SQL, Express, AI, REST, API, SPA, Excel",2025-06-03T10:50:40,Mexico
full_time,Lead Científico de Datos,Jooble,77998.0,No especificado,"R, AWS, AI, REST, API, SPA, Git",2025-05-31T00:51:37,USA
full_time,Senior Científico de Datos,Adzuna,52082.0,No especificado,"Go, R, Redis, AI, API, SPA, Git",2025-05-29T00:51:07,USA
full_time,Senior Ingeniero de Machine Learning,Jooble,39845.0,No especificado,"JavaScript, Java, TypeScript, Scala, R, Express, Jenkins, GitHub Actions, AI, CI/CD, Agile, API, Backend, Excel, Git",2025-05-28T22:51:28,USA
full_time,Junior Analista de Datos,Adzuna,44975.0,No especificado,"Rust, R, AWS, AI, REST, API, Git",2025-05-23T06:51:04,USA
full_time,Senior Desarrollador Java,Jooble,37739.0,No especificado,"Go, R, AWS, AI, Deep Learning, API, Excel, Git",2025-05-22T04:50:02,Germany
full_time,Lead Administrador de Bases de Datos,Jooble,52065.0,No especificado,"Go, Rust, R, SQL, AI, API, SPA, Tableau, Looker, Excel",2025-05-14T10:50:50,USA
full_time,Junior Scrum Master,Jooble,67252.0,No especificado,"Scala, Rust, R, AWS, AI, DevOps, CI/CD, REST, API, Excel",2025-05-14T06:50:17,Brazil
full_time,Lead Desarrollador Mobile,Jooble,25365.0,No especificado,"Python, Go, TypeScript, R, React, Vue, MongoDB, AWS, Azure, GCP, Docker, Kubernetes, GitHub Actions, Terraform, AI, DevOps, CI/CD, REST, API, Frontend, Backend, SPA, Excel, Git, Linux",2025-05-14T02:52:18,"USA, Canada"
full_time,Lead Desarrollador Java,Jooble,67759.0,No especificado,"Python, JavaScript, Java, Go, Scala, Rust, R, SQL, React, Express, Google Cloud, GCP, Kubernetes, Terraform, AI, DevOps, REST, API, Frontend, Backend, SPA, Excel, Git",2025-05-13T16:50:14,India
full_time,Lead Administrador AWS,Jooble,57097.0,No especificado,"Go, Scala, R, SQL, MySQL, PostgreSQL, MongoDB, Cassandra, AWS, Terraform, Ansible, AI, DevOps, CI/CD, API, SPA, Spark, Excel, Git, Linux",2025-05-09T20:50:59,USA
full_time,Junior Desarrollador React,Jooble,30765.0,No especificado,"Python, Java, Go, Scala, R, Spring, AI, REST, Microservices, API, Backend, SPA, Git",2025-05-09T02:50:14,USA
full_time,Senior Analista de Datos,Adzuna,25477.0,No especificado,"Scala, Rust, R, AWS, GCP, Docker, Kubernetes, Terraform, Ansible, AI, DevOps, API, Git, Linux",2025-05-08T04:50:22,Worldwide
full_time,Senior Arquitecto de Software,Jooble,76284.0,No especificado,"Go, TypeScript, Rust, R, GCP, Heroku, AI, REST, API, ETL, Excel, Git",2025-05-04T02:50:55,"Europe, USA, Canada"
full_time,Junior Ingeniero de Machine Learning,Adzuna,62141.0,No especificado,"Python, Java, Go, Scala, R, SQL, Express, MySQL, AWS, Jenkins, GitLab, AI, DevOps, API, SPA, Git",2025-05-03T20:50:42,Poland
full_time,Lead Arquitecto de Software,Adzuna,71448.0,No especificado,"Go, Scala, R, React, AWS, Azure, Google Cloud, Docker, Kubernetes, Terraform, AI, DevOps, REST, API, SPA, Excel, Git",2025-04-28T06:51:07,USA
full_time,Semi Senior Especialista en Ciberseguridad,Jooble,49039.0,No especificado,"Go, TypeScript, Scala, Rust, R, SQL, PostgreSQL, AWS, GCP, Kubernetes, Terraform, AI, DevOps, API, Git",2025-04-27T18:51:04,Europe
full_time,Junior Desarrollador Java,Jooble,36602.0,No especificado,"Go, Scala, Rust, R, AWS, Google Cloud, Docker, Kubernetes, GitHub Actions, Terraform, Ansible, Machine Learning, AI, REST, API, Git, Linux",2025-04-22T10:50:37,USA
full_time,Lead Desarrollador Full Stack,Adzuna,37370.0,No especificado,"Python, Swift, Scala, R, SQL, Express, MySQL, PostgreSQL, AWS, Azure, GCP, Docker, Kubernetes, Terraform, Ansible, AI, CI/CD, API",2025-04-18T06:51:21,USA
full_time,Senior Desarrollador .NET,Adzuna,57079.0,No especificado,"Go, Scala, R, SQL, Express, MySQL, AWS, Kubernetes, Jenkins, GitLab, AI, DevOps, API, SPA, Git",2025-04-05T18:50:51,Poland
full_time,Junior Especialista en UX/UI,Jooble,62980.0,No especificado,"Python, Go, Scala, R, AWS, Azure, GCP, Docker, Kubernetes, Terraform, Ansible, AI, DevOps, CI/CD, API, SPA, Linux",2025-03-28T02:51:52,"USA, UK, Canada, Germany, France, Spain"
full_time,Junior Arquitecto de Software,Jooble,44037.0,No especificado,"Python, Java, C#, Go, Ruby, Rust, R, Express, Neo4j, AWS, Azure, GCP, Docker, Kubernetes, Terraform, Ansible, AI, DevOps, CI/CD, REST, API, SPA, Excel",2025-03-28T02:51:50,USA
full_time,Semi Senior Científico de Datos,Adzuna,57358.0,No especificado,"Python, Java, Go, Scala, Rust, R, AWS, Azure, Google Cloud, GCP, Docker, Kubernetes, AI, DevOps, CI/CD, Microservices, API, Frontend, Backend, SPA, Spark, Excel, Git",2025-03-25T16:50:21,Netherlands
full_time,Junior Desarrollador Python,Jooble,79653.0,No especificado,"Python, Java, Go, Rust, R, SQL, AWS, AI, Agile, API, SPA, ETL, Spark",2025-05-31T04:50:49,USA
,Frontend Developer,Jooble,61613.0,,,,
,Lead Administrador de Sistemas,Adzuna,65909.0,Heap,,2025-06-19T09:48:34.7400000,Kingdom of Spain
,Senior Desarrollador Frontend,Adzuna,41215.0,IGT,,2025-06-11T07:33:31.4670000,Kingdom of Spain
,Senior Ingeniero de QA,Jooble,75595.0,SpotOn Connections,,2025-06-16T16:00:44.7330000,Kingdom of Spain
,Junior Especialista en UX/UI,Adzuna,40578.0,IGT,,2025-06-02T20:52:59.4930000,Kingdom of Spain
,Senior Site Reliability Engineer,Jooble,64845.0,IGT,,2025-05-27T08:47:37.6170000,Kingdom of Spain
,Lead Desarrollador .NET,Adzuna,74516.0,Heap,,2025-06-09T07:54:29.1770000,Kingdom of Spain
,Lead Especialista DevSecOps,Jooble,62937.0,Heap,,2025-05-31T04:44:17.1317421+00:00,Kingdom of Spain
,Junior Desarrollador .NET,Jooble,40155.0,IGT,,2025-05-25T07:33:47.2900000,Kingdom of Spain
,Semi Senior Analista de Datos,Jooble,68309.0,Heap,,2025-05-22T23:28:40.6070632+00:00,Kingdom of Spain
,Junior Product Owner,Jooble,34569.0,Jet Aviation,,2025-06-06T19:31:52.8330000,Kingdom of Spain
,Semi Senior Especialista DevSecOps,Jooble,35407.0,First Health Care of Puerto Rico,,2025-05-30T08:09:38.8645890+00:00,Kingdom of Spain
,Junior Ingeniero de QA,Adzuna,52518.0,Hasbro,,2025-05-27T00:00:00.0000000,Kingdom of Spain
,Lead Ingeniero de Redes,Adzuna,56013.0,IGT,,2025-05-23T00:00:00.0000000,Kingdom of Spain
,Senior Desarrollador .NET,Jooble,34815.0,IGT,,2025-06-10T07:33:38.1330000,Kingdom of Spain
,Lead Ingeniero DevOps,Adzuna,52566.0,,,2025-05-16T14:34:00.3240843+00:00,Kingdom of Spain
,Lead Científico de Datos,Adzuna,48768.0,Greystar,,2025-06-19T09:09:08.0970000,Kingdom of Spain
,Lead Product Owner,Jooble,78949.0,,,2025-06-18T16:40:28.9370000,Kingdom of Spain
,Lead Administrador de Bases de Datos,Jooble,37197.0,Jet Aviation,,2025-06-09T00:00:00.0000000,Kingdom of Spain
,Semi Senior Administrador de Sistemas,Jooble,52356.0,,,2025-06-13T05:13:20.1930000,Kingdom of Spain
,Senior Product Owner,Adzuna,59907.0,Jet Aviation,,2025-05-29T00:00:00.0000000,Kingdom of Spain
,Lead Analista de BI,Jooble,75394.0,IGT,,2025-06-13T00:00:00.0000000,Kingdom of Spain
,Lead Arquitecto de Software,Adzuna,31788.0,First Health Care of Puerto Rico,,2025-06-17T12:02:36.1670000,Kingdom of Spain
,Senior Cloud Engineer,Jooble,47833.0,Avincis,,2025-06-07T00:00:00.0000000,Kingdom of Spain
,Lead Desarrollador Python,Jooble,47851.0,Teva Pharmaceutical Industries Ltd.,,2025-05-29T07:24:41.9904889+00:00,Kingdom of Spain
,Junior Cloud Engineer,Adzuna,41163.0,Heap,,2025-05-24T04:44:24.3173272+00:00,Kingdom of Spain
full_time,Semi Senior Desarrollador Java,Adzuna,72541.0,No especificado,"R, AI, API",2025-06-18T14:51:45,Indonesia
full_time,Semi Senior Desarrollador Java,Jooble,66959.0,No especificado,"Go, TypeScript, R, SQL, React, Express, Rails, Redis, AWS, Kubernetes, AI, CI/CD, REST, GraphQL, API, Frontend, Backend, Excel",2025-06-18T14:51:32,Americas
full_time,Senior Ingeniero de Redes,Adzuna,73462.0,No especificado,"Go, Scala, R, AI, Agile, API, SPA, Excel",2025-06-18T14:51:02,Philippines
full_time,Junior Cloud Engineer,Jooble,58852.0,No especificado,"JavaScript, Java, Swift, R, AI, API, UI/UX, Backend, Git",2025-06-18T14:50:47,India
contract,Semi Senior Especialista en Ciberseguridad,Adzuna,39135.0,No especificado,"Go, R, SQL, SQL Server, AI, API, SPA, ETL, Tableau, Power BI, Excel",2025-06-18T07:31:18,CET +/- 3 HOURS
full_time,Senior Desarrollador Backend,Adzuna,61229.0,No especificado,"Go, R, Express, AI, REST, API, SPA, Excel, JIRA",2025-06-17T20:51:17,Poland
full_time,Semi Senior Especialista DevSecOps,Jooble,74784.0,No especificado,"Go, Scala, R, AI, API, Excel, Git",2025-06-17T20:51:08,South Africa
full_time,Lead Desarrollador React,Jooble,52833.0,No especificado,"Go, Rust, R, AI, REST, API, SPA, Excel, Git",2025-06-17T18:50:27,"Europe, USA"
full_time,Lead Analista de Datos,Adzuna,47980.0,No especificado,"Go, R, SQL, AWS, Jenkins, AI, CI/CD, Agile, Scrum, API, Excel, JIRA, Git",2025-06-17T16:50:12,USA
full_time,Junior Desarrollador Full Stack,Adzuna,35957.0,No especificado,"Go, Rust, R, AI, Agile, Scrum, API, SPA, Excel, Git",2025-06-17T12:51:38,USA
full_time,Lead Desarrollador Python,Jooble,38139.0,No especificado,"JavaScript, Java, PHP, Go, TypeScript, Scala, R, React, Angular, Vue, AI, REST, API, UI/UX, Excel, Git",2025-06-17T12:50:45,Bulgaria
full_time,Senior Scrum Master,Adzuna,71580.0,No especificado,"JavaScript, Java, Go, R, React, Machine Learning, AI, REST, API, Frontend, Backend, SPA, Git",2025-06-17T12:50:41,"Europe, South America"
full_time,Senior Ingeniero de QA,Jooble,47397.0,No especificado,"JavaScript, Java, C++, Go, Kotlin, Rust, R, Express, Redis, AWS, AI, API, SPA, Excel",2025-06-17T12:50:37,France
full_time,Junior Especialista en Ciberseguridad,Adzuna,77948.0,No especificado,"R, Express, AI, Agile, API, SPA, JIRA",2025-06-16T12:51:18,Spain
full_time,Semi Senior Arquitecto de Software,Adzuna,51024.0,No especificado,"Go, Scala, Rust, R, Express, AI, Agile, API",2025-06-16T12:51:09,USA
contract,Lead Ingeniero de Redes,Jooble,36990.0,No especificado,"Go, Rust, R, AI, REST, API, SPA, ETL",2025-06-16T10:16:18,"Americas, Europe, Israel"
contract,Semi Senior Especialista en UX/UI,Adzuna,35937.0,No especificado,"Go, Rust, R, AI, REST, API, SPA, ETL",2025-06-16T10:16:07,"Americas, Europe, Israel"
full_time,Lead Administrador AWS,Jooble,62381.0,No especificado,"Python, PHP, Scala, R, SQL, PostgreSQL, AWS, AI, REST, API, Backend, SPA, Excel, Linux",2025-06-15T22:50:17,Canada
full_time,Senior Desarrollador Mobile,Adzuna,73699.0,No especificado,"Python, R, SQL, Machine Learning, AI, API",2025-06-15T16:51:19,USA
internship,Semi Senior Especialista DevSecOps,Adzuna,38948.0,No especificado,"Python, C#, TypeScript, R, SQL, React, ASP.NET, PostgreSQL, AI, CI/CD, REST, API, Full Stack",2025-06-15T16:50:31,Ukraine
full_time,Lead Cloud Engineer,Adzuna,37664.0,No especificado,"JavaScript, Java, C#, Go, TypeScript, R, SQL, Angular, ASP.NET, SQL Server, Azure, AI, DevOps, CI/CD, Agile, REST, API, Excel, Git",2025-06-15T16:50:30,"UK, India"
contract,Lead Desarrollador React,Jooble,61956.0,No especificado,"Python, Rust, R, Oracle, Ansible, AI, DevOps, Agile, API, Excel, Git",2025-06-15T16:50:30,USA
full_time,Lead Desarrollador React,Jooble,44830.0,No especificado,"Rust, R, AWS, Kubernetes, Terraform, Machine Learning, AI, DevOps, API, SPA, Tableau",2025-06-15T10:52:07,USA
full_time,Semi Senior Desarrollador .NET,Jooble,65522.0,No especificado,"Python, Java, Go, R, SQL, Google Cloud, GCP, AI, API, SPA, Excel, Git",2025-06-15T10:51:52,India
